SWINNO - updated,9547001,LignoBoost-processen,,Teknik för att utvinna högvärdigt biobränsle ur massabrukens svartlut. Det lignin som idag utvinns är renare och har högre torrhalt än vad som har varit möjligt med tidigare metoder. Lignin är alltså ett biobränsle. Lignoboost kommersialiserar en patentskyddad teknik.,Chemical and Plastics,20101,-100,,,,3366,"Företaget är ett dotterföretag till STFI-Packforsk (numera Innventia).
Patent granted according to SPCI 2008 5 42
Processen såldes 2008 till företaget Metso Power (Kemivärlden Biotech med Kemisk Tidskrift, 2009, nr.6, p.15.) och saluförs idag (2015) av Valmet (finländskt).  (SPCI Svensk Papperstidning, 2015, nr. 3, p. 36)",1,3,2,2006,,1,2,1,LignoBoost AB ; LignoBoost ; 8549002,Kristinehamn,NA,Innventia AB,1,,,NA,NA,NA,1999,NA,NA,NA,NA,NA,NA,1b,5a,,,,,Patentskydda teknik för utvinning av lignin ur svartlut,,,,,1,STFI-Packforsk (Innventia),,,Chalmers,Mittuniversitetet,NA,1,Chalmers Tekniska Högskola ; Chalmers Tekniska Högskola ; 13439002,11,SWE,Innventia ; Innventia ; 10551002,14,SWE,,NA,,,NA,,,NA,,,NA,,NA,,1,STFI-Packforsk ; STFI Packforsk ; 8550002,10,Södra ; Södra ; 10557002,9,Stora Enso ; Stora Enso ; 9752002,9,Fortum Värme ; Fortum Värme ; 12184002,8,Statens Energimyndighet ; Energimyndigheten ; 12148002,7,,NA,,NA,,NA,,NA,,NA,,NA,1 ; SPCI Svensk Papperstidning ;  ; 2006 ; 7 ; 14-16 ; ,1 ; SPCI Svensk Papperstidning ;  ; 2007 ; 2 ; 46 ; ,1 ; Ny Teknik ;  ; 2006 ; 23 ; 6 ; ,2 ; Ny Teknik ;  ; 2008 ; 8 ; 24-25 ; ,5 ; Kemivärlden Biotech med Kemisk Tidskrift ;  ; 2012 ; 1-2 ; 8 ; ,1 ; Svensk Papperstidning ;  ; 2008 ; 3 ; 8 ; ,1 ; Svensk Papperstidning ;  ; 2008 ; 5 ; 42 ; ,5 ; Svensk Papperstidning ;  ; 2008 ; 5 ; 48-49 ; ,2 ; Svensk Papperstidning ;  ; 2008 ; 5 ; 76-78 ; 76,2 ; Svensk Papperstidning ;  ; 2010 ; 2 ; 12-13 ; ,2 ; Svensk Papperstidning ;  ; 2010 ; 8 ; 36-37 ; ,1 ; Svensk Papperstidning ;  ; 2010 ; 8 ; 37 ; ,2 ; Svensk Papperstidning ;  ; 2012 ; 5 ; 11 ; ,2 ; Svensk Papperstidning ;  ; 2012 ; 6 ; 30-31 ; ,2 ; Svensk Papperstidning ;  ; 2013 ; 3 ; 36-37 ; 37,1 ; Svensk Papperstidning ;  ; 2013 ; 4 ; 6 ; ,5 ; Kemivärlden Biotech med Kemisk Tidskrift ;  ; 2009 ; 6 ; 13 ; ,NA
SWINNO - updated,7569001,,,"Balk av asp som är starkare, styvare, lättare och billigare än motsvarande balkar i trä eller stål. Balken är patenterad och bygger på en ny produktionsmetod.",Chemical and Plastics,20301,45,,,,3400,,1,3,2,2007,,1,NA,1,Newbeam Sweden AB ; Newbeam Sweden ; 6571002,,NA,,1,,,NA,NA,NA,NA,NA,NA,NA,NA,NA,NA,7,3,1b,,,,Mekanisk pressteknik som möjliggör pressning av profilerade träkompositbalkar av tunn  belimmad aspflis.,,,Styrka; styvhet; lättare vikt,,NA,,,,,,NA,NA,,NA,,,NA,,,NA,,,NA,,,NA,,,NA,,NA,,1,Almi ; Almi ; 12088002,2,,NA,,NA,,NA,,NA,,NA,,NA,,NA,,NA,,NA,,NA,1 ; NTT ;  ; 2007 ; 2 ; 5 ; ,,,,,,,,,,,,,,,,,NA
SWINNO - updated,7579001,UM Chip Diverter,UM Chip Diverter,"Propeller som blåser upp spån och damm i utsuget så att fräsningen blir renare och mer effektiv. Genom att propellern snurrar med verktyget så uppstår ett vakuum runt området som bearbetas så att spån och damm riktas upp mot spånhuven. Detta ger bättre arbetsmiljö med mindre spån och damm, maskinen hålls renare och ståndtid förlängs eftersom verktyget inte behöver skära spånor flera gånger. Sammantaget innebär det också färre driftsavbrott, vilket i sin tur medför bättre flöde i produktionen.",Machinery and Equipment,28622,20101,,,,3405,,1,2,2,2007,,1,1,NA,Unimerco ; Unimerco ; 10064002,,NA,,NA,,,NA,NA,NA,NA,NA,NA,NA,NA,NA,NA,7,,,,,,,,,Ger bättre arbetsmiljö för användaren (minskar spån och damm); håller maskinen renare; ger förlängd ståndtid,,NA,,,,,,NA,NA,,NA,,,NA,,,NA,,,NA,,,NA,,,NA,,NA,,NA,,NA,,NA,,NA,,NA,,NA,,NA,,NA,,NA,,NA,,NA,,NA,1 ; NTT ;  ; 2007 ; 22 ; 7 ; ,,,,,,,,,,,,,,,,,NA
SWINNO - updated,9089001,,,Nytt byggsystem för höga trähus med en balken som klarar långa spännvidder och dämpar stegljud.,Chemical and Plastics,20302,20301,,,,3411,,1,3,2,2007,,1,NA,NA,Swelite ; Swelite ; 8091002,,NA,,NA,,,NA,NA,NA,NA,NA,NA,NA,NA,NA,NA,7,3,,,,,,,,Materialsnål konstruktion; klara långa spännvidder; dämpar stegljud,,1,,,,"Institutionen för byggteknik, Umeå Universitet",,NA,NA,,NA,,,NA,,,NA,,,NA,,,NA,,,NA,,NA,,NA,,NA,,NA,,NA,,NA,,NA,,NA,,NA,,NA,,NA,,NA,,NA,1 ; Ny Teknik ;  ; 2006 ; 12 ; 12 ; ,,,,,,,,,,,,,,,,,NA
SWINNO - updated,9181001,GasFIndIR,GasFIndIR,"Gaskamera som kan se metangasläckor och andra osynliga miljö- och hälsoskadliga gaser. Kameran är en vidareutveckling av en vanlig värmekamera som mäter infrarödstrålning, men kameran filmar IR-strålningen i mellanvågsområdet 3-5 mikrometer. Kameran är utrustad med ett filter som kyls ner till ungefär -200 grader, vilket gör att man kan avgränsa den värmestrålning kameran känner av till en väldigt liten del av det infraröda området.",Machinery and Equipment,33400,11,24,,,3424,,1,2,2,2007,,2,NA,NA,Flir System ; Flir Systems ; 5631002,,NA,,NA,,,NA,NA,NA,NA,NA,NA,NA,NA,NA,NA,5a,4,1b,,,,,,,,,NA,,,,,,NA,NA,,NA,,,NA,,,NA,,,NA,,,NA,,,NA,,NA,,NA,,NA,,NA,,NA,,NA,,NA,,NA,,NA,,NA,,NA,,NA,,NA,1 ; Ny Teknik ;  ; 2007 ; 11 ; 10 ; ,,,,,,,,,,,,,,,,,NA
SWINNO - updated,9229001,Capee Dashboard / Capee Action Station,,"Verktyg för driftanalys baserat på Spotfires mjukvara. Programmet utnyttjar befintlig driftsdata från de ordinarie övervakningssystemen, miljödatabaser, labbrapporter med mera. Upptäcker man en avvikelse i produktionen kan mjukvaran hjälpa operatörerna att hitta orsaken på kortast möjliga tid.",,72210,-100,,,,3447,,1,2,3,2007,,1,NA,NA,Capee Group ; Capee Group ; 8231002,Göteborg,NA,,1,,,NA,NA,NA,NA,NA,NA,NA,NA,NA,NA,5a,20,,,,,,,,,Programmet är baserat på Spotfires mjukvara,NA,,,,,,NA,NA,,NA,,,NA,,,NA,,,NA,,,NA,,,NA,,NA,,NA,,NA,,NA,,NA,,NA,,NA,,NA,,NA,,NA,,NA,,NA,,NA,1 ; Ny Teknik ; Automation ; 2007 ; 47 ; 22 ; ,1 ; Verkstäderna ; Process Magasin ; 2014 ; 6 ; 8 ; ,4 ; Automation ;  ; 2013 ; 2 ; 37 ; ,5 ; Verkstäderna ; Process Magasin ; 2015 ; 1 (6) ; 10-11 ; ,,,,,,,,,,,,,,NA
SWINNO - updated,9551001,L&W Autoline 400,,System av automationslösning för pappersprovning i laboratoriemiljö. ,Machinery and Equipment,33300,21,,,,3453,,1,NA,NA,2007,,3,NA,NA,Lorentzen & Wettre ; Lorentzen & Wettre ; 8256002,,NA,,NA,,,NA,NA,NA,NA,NA,NA,NA,NA,NA,NA,7,,,,,,,,,,,NA,,,,,,NA,NA,,NA,,,NA,,,NA,,,NA,,,NA,,,NA,,NA,,NA,,NA,,NA,,NA,,NA,,NA,,NA,,NA,,NA,,NA,,NA,,NA,1 ; SPCI Svensk Papperstidning ;  ; 2007 ; 2 ; 48 ; ,,,,,,,,,,,,,,,,,NA
SWINNO - extension,10882001,Sioo,,"Vattenburet träskydd med kisel, kalium och naturliga växtämnen.",,24140,-101,20,,,3472,,1,3,2,2007,,1,NA,0,Wood Protection AB ; Wood Protection ; 10354002,Göteborg,NA,,NA,,,NA,NA,NA,NA,NA,NA,NA,NA,NA,NA,7,12,,,,,,,,,,NA,,,,,,NA,NA,,NA,,,NA,,,NA,,,NA,,,NA,,,NA,,NA,,NA,,NA,,NA,,NA,,NA,,NA,,NA,,NA,,NA,,NA,,NA,,NA,1 ; NTT ;  ; 2010 ; 9 ; 14 ; ,,,,,,,,,,,,,,,,,NA
SWINNO - extension,11074001,re-load-pallen,,"En modulbyggd lastpall utan spik. Sammanfogning bygger på snäpplåsning och på en träpall fungerar den så här: ""En cirka fjorton centimeter lång hylsa går igenom förborrade hål i de nedre pallmedarna, genom en plastkloss och slutligen genom regelbrädorna och de övre däckbrädorna på lastytan. Från andra hållet går en plugg genom hylsan, försedd med cirkulära hullingar, som hakar tag i motsvarande spår i hylsan. Monteringen sker med hydraulisk press.""

Pallen är mer miljövänlig och har ingen spik som kan skada personal, gods eller golv. ",Chemical and Plastics,20400,-100,,,,3475,Somebody has commissioned the innovation but it does not say who. The year of commercialization and of development is to some extent a result of interpretation.,1,3,3,2007,,2,NA,2,Re-Load ; Re-Load ; 10498002,Färila,NA,,1,,,NA,NA,NA,2002,NA,NA,NA,NA,NA,NA,4,7,12,,,,,,,,,NA,,,,,,NA,NA,,NA,,,NA,,,NA,,,NA,,,NA,,,NA,,NA,,NA,,NA,,NA,,NA,,NA,,NA,,NA,,NA,,NA,,NA,,NA,,NA,1 ; Verkstäderna ; Fogningsteknik ; 2010 ; 4 ; 2 ; ,,,,,,,,,,,,,,,,,NA
SWINNO - extension,11243001,Service Point,,"Pakethantering med drygt 1100 in- och utlämningsställe. Alla paket som hanteras i systemet koldioxid-kompenseras ""genom investering i ny teknologi för fordon, användande av förnybart bränsle med ny teknologi, investeringar i solfångarprojekt och metanutvinning och biogasproduktion men också genom stöd till skogsplantering."" ",,63400,-100,-101,,,3477,,1,3,3,2007,,2,NA,0,DHL Express ; DHL Express ; 10625002,,NA,,NA,,,NA,NA,NA,NA,NA,NA,NA,NA,NA,NA,12,,,,,,,,,,,NA,,,,,,NA,NA,,NA,,,NA,,,NA,,,NA,,,NA,,,NA,,NA,,NA,,NA,,NA,,NA,,NA,,NA,,NA,,NA,,NA,,NA,,NA,,NA,1 ; Transport iDag ;  ; 2008 ; 1 ; 4 ; ,,,,,,,,,,,,,,,,,NA
SWINNO - extension,11252001,Blenda,,"Solfångare som ""är ett mellanting mellan panelsolfångare och vakuumrör.""  (Energi & Miljö, 2008, nr. 4, p. 52-53) På sommaren när solen står högt begränsas intaget, medans det hela ytan används på vår och höst då ""solstrålarna koncentreras 3,7 gånger till den värmeupptagande absorbatorn"" (Energi & Miljö, 2008, nr. 4, p. 52-53)",,29230,45331,,,,3478,,1,2,2,2007,,1,NA,2,Solarus ; Solarus ; 10634002,Norrtälje,NA,,NA,Vattenfall (Älvkarleby),,NA,NA,NA,NA,NA,NA,NA,NA,NA,NA,19,,,,,,,,,,,NA,,,,,,NA,NA,,NA,,,NA,,,NA,,,NA,,,NA,,,NA,,NA,,NA,,NA,,NA,,NA,,NA,,NA,,NA,,NA,,NA,,NA,,NA,,NA,3 ; Energi & Miljö ;  ; 2008 ; 4 ; 52-53 ; ,1 ; Ny Teknik ;  ; 2008 ; 45 ; 20 ; ,,,,,,,,,,,,,,,,NA
SWINNO - extension,11620001,Scan-ice,Scan-ice,Koncept för konstis som uppnår ca 90% av glideffekten jämfört med vanlig is. Eftersom ingen kylning behövs sparas energi för exempelvis ishallar och kan dessutom användas i varmare miljöer. Konceptet baseras på ett HDPE-material som Polykemi AB tagit fram och som sedan ytbehandlas för att minimera friktionen. Produkten har ett patenterat sammanfogningssystem där de formsprutade bitarna fogas samman med en plasthammare.,,25240,92615,,,,3481,Ett svenskt-norskt samarbete mellan Polykemi AB och norska Scansis AS där de förra har tagit fram HDPE-materialet och de senare ytbehandlingen.,1,3,3,2007,,2,NA,0,Polykemi AB ; Polykemi ; 10120002,,NA,,NA,,,NA,NA,NA,NA,NA,NA,NA,NA,NA,NA,7,,,,,,,,,Eftersom ingen kylning behövs sparas energi för exempelvis ishallar och kan dessutom användas i varmare miljöer.,,NA,,,,,,NA,1,Scansis AS ; Scansis AS ; 13699002,18,NOR,,NA,,,NA,,,NA,,,NA,,,NA,,NA,,NA,,NA,,NA,,NA,,NA,,NA,,NA,,NA,,NA,,NA,,NA,,NA,1 ; Plastforum ;  ; 2008 ; 3 ; 65 ; ,1 ; Plastforum ;  ; 2008 ; 12 ; 20 ; ,,,,,,,,,,,,,,,,NA
SWINNO - extension,11745001,,,Kabellock av träfiberkomposit som är till för att skydda kabel som läggs ned vid järnväg. Det kan ersätta betong som vanligen används med fördelen att det nya locket är lättare att montera och installera. ,,25240,45,,,,3483,Vann plastovationer 2007.,1,3,3,2007,,3,NA,0,OFK Plast AB ; OFK Plast ; 10395002,,NA,,NA,,,NA,NA,NA,NA,NA,NA,NA,NA,NA,NA,7,1b,,,,,,,,"""-Produkten togs fram i syfte att kabel som bland annat läggs ner längs järnvägar. I stätllet för att använda sig av betong, vilket var ddet material som användes då, valde OFK Plast att extrudera profilen av återvunnen polyeten och återvunna träfibrer. Fördelen med det nya materialvalet var att et skulle bli lättare att montera och installera. Dessutom var vikten lägre och livslängden lägnre, hävdade tillverkaren.""  (Plastforum, 2012, nr. 3, p. 26-27)",,NA,,,,,,NA,1,Swedish Cabel Channel Systems AB ; Swedish Cabel Channel Systems ; 13246002,17,SWE,,NA,,,NA,,,NA,,,NA,,,NA,,NA,,NA,,NA,,NA,,NA,,NA,,NA,,NA,,NA,,NA,,NA,,NA,,NA,2 ; Plastforum ;  ; 2012 ; 3 ; 26-27 ; ,1 ; Plastforum ;  ; 2007 ; 10 ; 38-39 ; ,,,,,,,,,,,,,,,,NA
SWINNO - updated,9092001,CIGS,,"Tunnfilmssolceller. Cellerna får ett skikt av zinkoxysulfid istället för kadmiumsulfid, som är miljöfarligt och kräver dispens från Kemikalieinspektionen.",,32100,40,-100,,,3500,Köptes 2006 av tyska Q-Cells och produktionen flyttades till Tyskland men FOU kvar i Uppsala.,1,2,1,2008,,1,2,NA,Solibro ; Solibro ; 8094002,Uppsala,NA,,1,,,NA,NA,NA,NA,2001,NA,NA,NA,NA,NA,12,,,,,,,,,,,1,,,,Ångström Solar Center (Uppsala universitet),,NA,NA,,NA,,,NA,,,NA,,,NA,,,NA,,,NA,,NA,,NA,,NA,,NA,,NA,,NA,,NA,,NA,,NA,,NA,,NA,,NA,,NA,1 ; Ny Teknik ;  ; 2006 ; 9 ; 8-9 ; ,1 ; Ny Teknik ;  ; 2008 ; 43 ; 28 ; ,1 ; Kemivärlden Biotech med Kemisk Tidskrift ;  ; 2009 ; 3 ; 10 ; ,,,,,,,,,,,,,,,NA
SWINNO - updated,9120001,,,Miljövänliga gödselmedel för trädplantor som bygger på aminosyror vilka innehåller det kväve som växterna behöver. 2008 vil Swetree börja testa gödsel också på andra typ er av plantor,Textile,24150,1410,,,,3501,,1,3,1,2008,,1,NA,NA,Swetree Technologies ; Swetree Technologies ; 8122002,Umeå,NA,,1,,,NA,NA,NA,NA,NA,NA,NA,NA,NA,NA,1a,12,,,,Forskningsresultat gällande aminosyror som ska användas i framställningen av gödselmedlet,,,,,,1,,,,Umeå Plant Science Center,KTH,NA,1,Sveriges Lantbruksuniversitet ; Sveriges Lantbruksuniversitet ; 12412002,11,SWE,,NA,,,NA,,,NA,,,NA,,,NA,,NA,,NA,,NA,,NA,,NA,,NA,,NA,,NA,,NA,,NA,,NA,,NA,,NA,1 ; Ny Teknik ;  ; 2006 ; 24 ; 32 ; ,1 ; Ny Teknik ;  ; 2008 ; 48 ; 24 ; ,,,,,,,,,,,,,,,,NA
SWINNO - updated,9211001,Neptune Formula,Neptune Formula,"Giftfri båtbottenfärg som är självpolerande och innehåller ett medel som bryts ned i vatten. Vid nedbrytningen förbrukas syre, och det uppstår en syrefattig miljö i ett gränsskikt på båtens botten. Frånvaron av syre hindrar musslor, snäckor, havstulpaner och liknande från att sätta sig fast och växa.",,24300,101,,,,3506,Ny Teknik 2008 deals with a similar product for ship propellors but does not explain how that differs from the paint boat bottoms.,1,3,1,2008,,2,NA,1,Ekomarine ; Ekomarine ; 8213002,,NA,,NA,,,NA,NA,NA,NA,NA,NA,NA,NA,NA,NA,1a,,,,,,,,,,,1,Tjärnö marinbiologiska laboratorium,,,,,NA,1,Ytkemiska Institutet ; Ytkemiska Institutet ; 6044002,14,,,NA,,,NA,,,NA,,,NA,,,NA,,NA,,1,Östersjöstiftelsen ; Östersjöstiftelsen ; 12323002,7,Allba Invest ; Allba Invest ; 12087002,9,,NA,,NA,,NA,,NA,,NA,,NA,,NA,,NA,,NA,1 ; Ny Teknik ;  ; 2007 ; 35 ; 19 ; ,1 ; Ny Teknik ;  ; 2008 ; 4 ; 20 ; ,2 ; Ny Teknik ;  ; 2008 ; 11 ; 28 ; ,1 ; Kemivärlden Biotech med Kemisk Tidskrift ;  ; 2008 ; 9 ; 10 ; ,,,,,,,,,,,,,,NA
SWINNO - extension,10827001,Generation xWoodline,,"En metod att måla olika träslag på vanlig svensk gran. Det finna ""inga begränsningar"" (NTT, 2008, nr. 3, p. 12) på vad de kan måla med deras nuvarande anläggning.",Chemical and Plastics,20510,36,,,,3510,"Akzo, let her use their lab
Dorotea Kommun- donated the factory building",3,3,3,2008,,1,2,1,Zwahlen Industries ; Zwahlen Industries ; 10311002,Dorotea,1,,1,,,NA,NA,2000,2006,NA,NA,NA,NA,NA,NA,12,5a,,,,,,,,,,NA,,,,,,NA,1,,NA,,,NA,,,NA,,,NA,,,NA,,,NA,,NA,,1,Jämtlands Provisionsbank ; Jämtlands Provinsbank ; 12247002,9,Almi ; Almi ; 12088002,2,Norrlandsfonden ; Norrlandsfonden ; 12313002,4,Vattenfall Inlandskraft ; Vattenfall Inlandskraft ; 12459002,8,länsstyrelsen i Västerbotten ; Länsstyrelsen i Västerbotten ; 12276002,7,,NA,,NA,,NA,,NA,,NA,,NA,1 ; NTT ;  ; 2008 ; 3 ; 12 ; ,1 ; NTT ;  ; 2009 ; 3 ; 6 ; ,,,,,,,,,,,,,,,,NA
SWINNO - extension,10970001,,,"""Den enda havredrycken i världen med med bevarade betangluktaner"". Miljövänlig mjölk som ej ""tar vägen via kon"".",Textile,15890,-101,55,801,,3520,,1,3,2,2008,,1,2,2,Oatly ; Oatly ; 10419002,,NA,,1,,,NA,NA,NA,NA,NA,NA,NA,NA,NA,NA,12,1a,4,5a,19,,,,,,,1,,,,Lunds Universitet,,NA,NA,,NA,,,NA,,,NA,,,NA,,,NA,,,NA,,NA,,NA,,NA,,NA,,NA,,NA,,NA,,NA,,NA,,NA,,NA,,NA,,NA,2 ; Livsmedel i fokus ;  ; 2012 ; 1 ; 11 ; ,1 ; Livsmedel i fokus ;  ; 2015 ; 9 ; 14 ; ,1 ; Livsmedel i fokus ;  ; 2016 ; 1 ; 10-11 ; ,,,,,,,,,,,,,,,NA
SWINNO - extension,11052001,,,"Snäcka bestående till 60 procent av glasfibern polyamid 66. Ämnad för möbelmontering där man traditionellt använts snäckor av zamac, en zink- och aluminiumlegering. Den nya snäckan är dels hälften så tung som den tidigare vilket ger såväl miljömässiga som ekonomiska vinster då fraktkostnaderna minskar. Dessutom tål den högre belastning och har ljuddämpande egenskaper.",,25240,29,30,31,32,3528,Vann Plastovationer 2008.,1,3,2,2008,,2,NA,0,AD-Plast AB ; AD-Plast ; 10483002,Anderstorp,NA,M-Logistik AB,NA,,,NA,NA,2005,NA,NA,33,34,NA,NA,NA,1b,7,,,,,,,,,,NA,,,,,,NA,1,IKEA Components ; IKEA Components ; 13671002,17,SWE,,NA,,,NA,,,NA,,,NA,,,NA,,NA,,NA,,NA,,NA,,NA,,NA,,NA,,NA,,NA,,NA,,NA,,NA,,NA,1 ; Plastforum ;  ; 2010 ; 1-2 ; 18-19 ; ,1 ; Plastforum ;  ; 2009 ; 1-2 ; 22 ; ,1 ; Plastforum ;  ; 2012 ; 3 ; 29 ; ,,,,,,,,,,,,,,,NA
SWINNO - extension,11184001,Lovice,,"Sojabaserad glass, med egenutvecklad sojabas framställd på mekaniska och termisk väg. Produktionen är mer miljövänlig är för vanlig glass och dessutom har sojan hälsofrämjande egenskaper.",Textile,15520,-101,,,,3542,,1,3,3,2008,,1,1,0,BoFood ; BoFood ; 10584002,Karlshamn,NA,,NA,,,NA,NA,NA,NA,NA,NA,NA,NA,NA,NA,5b,,,,,,,,,Företaget letade efter en svensk sojaråvara men hittade ingen; därför valde man att finna en metod för att tillverka en egen för att slippa använda sojabönor med tveksamt miljömässigt ursprung.,,NA,,,,,,NA,NA,,NA,,,NA,,,NA,,,NA,,,NA,,,NA,,NA,,NA,,NA,,NA,,NA,,NA,,NA,,NA,,NA,,NA,,NA,,NA,,NA,1 ; Livsmedel i fokus ;  ; 2013 ; 3 ; 33-34 ; ,,,,,,,,,,,,,,,,,NA
SWINNO - extension,11358001,,,En metod som möjliggör återvinning av plastprodukter som innehåller bromerade flamskyddsmedel.,Wastewater Treatment,37200,37,,,,3558,,3,1,1,2008,,2,NA,0,Stena Technoworld Aktiebolag ; Stena Technoworld ; 12573002,Göteborg,NA,Stena Metall Group,NA,,,NA,NA,NA,NA,NA,NA,NA,NA,NA,NA,5b,,,,,,,,Möjliggör återvinning av plastprodukter som innehåller bromerade flamskyddsmedel. Detta har inte funnits innan.,,,NA,,,,,,NA,NA,,NA,,,NA,,,NA,,,NA,,,NA,,,NA,,NA,,NA,,NA,,NA,,NA,,NA,,NA,,NA,,NA,,NA,,NA,,NA,,NA,1 ; Bergsmannen 1 ; Nordic Steel & Mining Review ; 2009 ; 3 ; 93 ; ,,,,,,,,,,,,,,,,,NA
SWINNO - extension,11452001,Agrodiesel 15,,"En ""miljöklassad diesel med en 15-procentig inblandning av biokomponenter"" (Ny Teknik 2008, 15, p. 22)",,24660,-100,751,,,3569,,1,3,1,2008,,1,1,0,Swedish Biofuels ; Swedish Biofuels ; 10676002,Stockholm,NA,,NA,,,NA,NA,NA,2002,NA,NA,NA,NA,NA,NA,12,1a,,,,"""Tekniken har Angelika Hull utvecklat tillsammans med sin far Igor Golubkov, rysk expert på raketbränsle. - Vi har två grupper av patent, dels på de olika bränsleblandningarna, dels en ny process för tillverkningen, säger Angelica Hull. ""  (Ny Teknik, 2008, nr. 15, p. 22)",,,,,,NA,,,,,,NA,1,Svenska Lantmännen ; Svenska Lantmännen ; 12407002,17,SWE,Statoil ; Statoil ; 13081002,18,NOR,,NA,,,NA,,,NA,,,NA,,NA,,NA,,NA,,NA,,NA,,NA,,NA,,NA,,NA,,NA,,NA,,NA,,NA,1 ; Ny Teknik ;  ; 2008 ; 15 ; 22 ; ,1 ; Ny Teknik ;  ; 2008 ; 15 ; 22 ; ,,,,,,,,,,,,,,,,NA
SWINNO - extension,11505001,Bio-senz,,"""Biosensor, blodsocker online"" som ger direkt resultat av test.
""utrustning för att kontinuerligt mäta glukos och laktat i cellodling i bioprocesser."" ""Den bygger på samverkan mellan ett tunt sensorchip laddat med specifika enzym och värmeflödesdetektorer placerade i en biosensorenhet"" (Kemivärlden Biotech med Kemisk Tidskrift, 2013, nr. 12, p. 7)",Machinery and Equipment,33101,85,,,,3573,,1,2,2,2008,,1,NA,0,Senzime AB ; Senzime ; 11000002,Uppsala,NA,,NA,,,NA,NA,NA,NA,NA,NA,NA,NA,NA,NA,7,5a,,,,,,,,,,NA,,,,,,NA,NA,,NA,,,NA,,,NA,,,NA,,,NA,,,NA,,NA,,NA,,NA,,NA,,NA,,NA,,NA,,NA,,NA,,NA,,NA,,NA,,NA,2 ; Ny Teknik ;  ; 2008 ; 17 ; 24 ; ,1 ; Kemivärlden Biotech med Kemisk Tidskrift ;  ; 2013 ; 12 ; 7 ; ,,,,,,,,,,,,,,,,NA
SWINNO - extension,11624001,,,Återvinningsteknik som  möjliggör en 98% återvinning av allt material i däck. Den baseras på pyrolys med en temperatur under 300 grader vilket är väsentligt lägre än existerande teknik. I kombination med företagets katalysator kan utvunnet material såsom kol och olja återvinnas och användas i nya däck då de materialen bibehåller sin kvalitet.,,74202,37200,,,,3584,,1,2,2,2008,,2,2,0,AltimEco-Recycling Technologies AB ; AltimEco Recycling Technologies ; 10957002,Stockholm,NA,,NA,,,NA,NA,NA,NA,NA,NA,NA,NA,NA,NA,1b,7,,,,,,,,,,NA,,,,,,NA,NA,,NA,,,NA,,,NA,,,NA,,,NA,,,NA,,NA,,NA,,NA,,NA,,NA,,NA,,NA,,NA,,NA,,NA,,NA,,NA,,NA,1 ; Plastforum ;  ; 2008 ; 6 ; 19 ; ,,,,,,,,,,,,,,,,,NA
SWINNO - extension,11630001,,,"Lättviktsrobot som analyserar och modellerar robotens dynamiska beteende/rörelsemönster. Detta leder i sin tur till möjligheten att konstruera mer miljöanpassade, lättare och billigare robotar. Samtidigt så kan den trots detta bära lika tungt som en konventionell modell trots att den enbart väger en tredjedel så mycket. En ytterligare fördel är att olycksrisken minskar likväl.",,29220,-100,,,,3587,,1,2,2,2008,,2,NA,0,ABB Robotics ; ABB Robotics  ; 9831002,Västerås,NA,,NA,,,NA,NA,NA,NA,NA,NA,NA,NA,NA,NA,1b,5b,12,,,,,,,,,NA,,,,,,NA,1,Linköpings Universitet ; Linköpings universitet ; 11270002,11,SWE,,NA,,,NA,,,NA,,,NA,,,NA,,NA,,NA,,NA,,NA,,NA,,NA,,NA,,NA,,NA,,NA,,NA,,NA,,NA,1 ; Plastforum ;  ; 2008 ; 1-2 ; 44 ; ,,,,,,,,,,,,,,,,,NA
SWINNO - extension,11638001,,,"En process för återvinning av beståndsdelar av LCD-paneler: ""polariserande plastfilm, glassubstrat, färgfilter, transparenta elektrodskikt och flytande kristaller""  (Ny Teknik, 2008, nr. 39, p. 25)",Wastewater Treatment,37200,30020,,,,3590,,1,1,2,2008,,2,NA,0,Swedish LCD Center ; Swedish LCD Center ; 10752002,Borlänge,NA,,NA,,,NA,NA,NA,NA,NA,NA,NA,NA,NA,NA,12,4,7,,,,,,,"""Det unika är att vi återvinner beståndsdelar i skärmen utan att förstöra dem. Det blir ekononmiskt lönsamt och belastar inte miljön""  (Ny Teknik, 2008, nr. 39, p. 25)",,NA,,,,,,NA,1,Hans Andersson Metal ; Hans Andersson Metal ; 11186002,17,SWE,,NA,,,NA,,,NA,,,NA,,,NA,,NA,,NA,,NA,,NA,,NA,,NA,,NA,,NA,,NA,,NA,,NA,,NA,,NA,1 ; Ny Teknik ;  ; 2008 ; 39 ; 25 ; ,,,,,,,,,,,,,,,,,NA
SWINNO - extension,11694001,,,"Lister och ädelträ som produceras med en ""unik metod för att överföra mönster från ett träslag till ett annat."" Resultatet är att fur ser ut som tropiska eller ädel träslag.",Chemical and Plastics,20102,361,,,,3595,,1,3,2,2008,,1,2,2,Zwahlen Industries ; Zwahlen Industries ; 10311002,Dorotea,NA,,NA,,,NA,NA,NA,NA,NA,NA,NA,NA,NA,NA,1b,7,12,,,,Eva Zwahlen har utvecklat den patenterade ytbehandlingsmetoden i samarbete med färgföretaget Akzo Nobiel,,,det behandlade träet får beständighet; slitstyrka; reptålighet,"""Eva Zwahlen vill rädda regnskogen och tillverkar trä av vanlig taall coh gran som ser exklusivare ut""",NA,,,,,,NA,1,Akzo Nobel ; AkzoNobel ; 10000002,18,NLD,,NA,,,NA,,,NA,,,NA,,,NA,,NA,,1,Jämtlands Provinsbank ; Jämtlands Provinsbank ; 12247002,9,Länsstyrelsen i Västerbotten ; Länsstyrelsen i Västerbotten ; 12276002,7,Almi ; Almi ; 12088002,2,Norrlandsfonden ; Norrlandsfonden ; 12313002,4,Vattenfal Inlandskraft ; Vattenfall Inlandskraft ; 12459002,8,,NA,,NA,,NA,,NA,,NA,,NA,1 ; Ny Teknik ;  ; 2008 ; 41 ; 12-13 ; ,,,,,,,,,,,,,,,,,NA
SWINNO - extension,11771001,Fragment induced diversity (FIND),,Teknik för att optimera proteiner som grundar sig på att använda enkelsträngade (istället för dubbelsträngade) DNA-molekyler för att rekombinera proteinet ifråga. Dessa kan sedan användas i läkemedelskandidater av olika slag.,,73103,24420,,,,3601,,3,1,1,2008,,1,NA,2,Alligator Bioscience ; Alligator Bioscience ; 10175002,Lund,NA,,NA,,,NA,NA,NA,NA,NA,NA,NA,NA,NA,NA,1b,,,,,,,,,,,1,,,,Lunds Universitet,,NA,NA,,NA,,,NA,,,NA,,,NA,,,NA,,,NA,,NA,,NA,,NA,,NA,,NA,,NA,,NA,,NA,,NA,,NA,,NA,,NA,,NA,4 ; Kemivärlden Biotech med Kemisk Tidskrift ;  ; 2008 ; 4 ; 14 ; ,1 ; Kemivärlden Biotech med Kemisk Tidskrift ;  ; 2009 ; 6 ; 30 ; ,,,,,,,,,,,,,,,,NA
SWINNO - extension,12464001,FRP-serie,,Avfallskvarnar med ett särskilt utvecklat knivsystem för sönderdelning av återvinningsbara material. Systemets effektivitet håller nere såväl värmeutveckling (och därmed också energikostnaderna) som kostnader för slitage.,,29569,-100,,,,3615,Knivsystemet i modellen är mönsterskyddat.,1,2,3,2008,,2,NA,0,AB FRANSSONS VERKSTÄDER ; FRANSSONS VERKSTÄDER ; 12635002,Sundsvall,NA,,NA,,,NA,NA,NA,NA,NA,NA,NA,NA,NA,NA,7,,,,,,,,,minskad värmeutveckling och minskat slitage,,NA,,,,,,NA,NA,,NA,,,NA,,,NA,,,NA,,,NA,,,NA,,NA,,NA,,NA,,NA,,NA,,NA,,NA,,NA,,NA,,NA,,NA,,NA,,NA,1 ; Plastforum ;  ; 2008 ; 7-8 ; 49 ; ,1 ; Plastforum ; Plastguiden ; 2011 ; 1 ; 11 ; ,,,,,,,,,,,,,,,,NA
SWINNO - extension,12465001,,,Metod för att tillverka kompositprodukter genom att använda återvunnen plast och organiska fibrer och utan att använda tillsatser. Kompositerna har bearbetningsegenskaper liknande trä men med god motståndskraft mot fukt och röta samt hög slagtålighet.,,25230,25230,,,,3616,,1,2,2,2008,,2,NA,0,Polyplank ; Polyplank ; 11121002,,NA,,NA,,,NA,NA,NA,NA,NA,NA,NA,NA,NA,NA,1b,7,,,,,,,,"""Produkter [sic] har träs material- och bearbetningsegenskaper, god motståndskraft mot fukt och röta, hög slagseghet iett omfattande temperaturspann och lång livslängd""  (Plastforum, 2008, nr. 11, p. 13)",,NA,,,,,,NA,NA,,NA,,,NA,,,NA,,,NA,,,NA,,,NA,,NA,,NA,,NA,,NA,,NA,,NA,,NA,,NA,,NA,,NA,,NA,,NA,,NA,1 ; Plastforum ;  ; 2008 ; 11 ; 13 ; ,,,,,,,,,,,,,,,,,NA
SWINNO - extension,12565001,,,En bältesförsträckare med elmotor som komplement till krutladdning. Elmotorn aktiveras vid kraftiga inbromsningar för att dra åt bilbältena.,,34300,34100,,,,3625,,1,2,2,2008,,2,NA,0,Autoliv ; Autoliv ; 5810002,,NA,,NA,,,NA,NA,NA,NA,NA,NA,NA,NA,NA,NA,7,,,,,,,,,bättre komfort; kan varna bilföraren genom att vibrera med bältet,,NA,,,,,,NA,NA,,NA,,,NA,,,NA,,,NA,,,NA,,,NA,,NA,,NA,,NA,,NA,,NA,,NA,,NA,,NA,,NA,,NA,,NA,,NA,,NA,1 ; Elektroniktidningen ;  ; 2008 ; 12 ; 34 ; ,,,,,,,,,,,,,,,,,NA
