SWINNO - updated,8378001,,,Poröst verktygsstål. Stålet ska användas i formverktyg för formsprutning av termoplast och härdplast. När flytande plastmassa fyller verktyget i en formspruta är annars innestängd luft ett problem. Med det porösa stålet försvinner detta problemet. ,,27100,28621,,,,1856,,1,3,3,1988,,2,1,NA,ToolVac Engineering ; ToolVac Engineering ; 7380002,Perstorp,NA,,NA,,,NA,NA,NA,NA,NA,NA,NA,NA,NA,NA,7,,,,,,,,,Minskar problemet med luftbubblor.,,NA,,,,,,NA,NA,,NA,,,NA,,,NA,,,NA,,,NA,,,NA,,NA,,NA,,NA,,NA,,NA,,NA,,NA,,NA,,NA,,NA,,NA,,NA,,NA,1 ; Ny Teknik ;  ; 1988 ; 5 ; 14 ; ,,,,,,,,,,,,,,,,,NA
SWINNO - updated,8379001,,,Mikrodatorstyrd skogsmaskin. Maskinen är den första i sitt slag som arbetar enligt den s k värdeapteringsprincipen. Det innebär att virkesvolymen hos ett träd utnyttjas på ett sådant sätt att det ekonomiska ytbytet blir så stort som möjligt. De dagsaktuella virkespriserna matas in i en databas. Därefter är det bara för maskinföraren att fälla ett träd och mata in vilket trädslag det rör sig om. Maskinen arbetar sedan direkt mot prislistan. Trädets dimenstioner mäts och datorn beräknar hur trädet bör kapas för att det maximala virkesvärdet ska kunna tas till vara. ,,29320,2013,,,,1857,,1,2,2,1988,,2,2,NA,Ösa Försäljnings AB ; Ösa Försäljnings ; 7381002,Alfta,NA,,NA,,,NA,NA,NA,NA,NA,NA,NA,NA,NA,NA,7,5a,,,,,,,,Mikrodatorstyrd. Optimerar uttaget av virke. ,,NA,,,,,,NA,NA,,NA,,,NA,,,NA,,,NA,,,NA,,,NA,,NA,,NA,,NA,,NA,,NA,,NA,,NA,,NA,,NA,,NA,,NA,,NA,,NA,1 ; Ny Teknik ;  ; 1988 ; 5 ; 28 ; ,,,,,,,,,,,,,,,,,NA
SWINNO - updated,8394001,,,"Natrium-svavel-batteri. Energitätheten i batteriet är fyra gånger så hög som i de bästa blybatterierna. Batteriet ger lägre driftskostnader än med bensindrift. Elektroniskt styrt drivsystem för elbilar. I kombination med ett nytt högenergibatteri av typ natriumsvavel uppnås en körsträcka av ca 170 km vid en medelfart av ca 50 km/h. Utvecklingen av eldrivna fordon för landsvägstraffik har aktualiserats på grund av stigande priser på drivmedel och ökande krav på bättre miljö. Konstruktionsarbetet har koncentrerats på batterier med små dimensioner och låg vikt men hög energitäthet och lång livslängd. ABB:s drivssytem för elbilar består av fyra enheter; drivmotor, växellåda och manöverdon samt styr- och övervakningselektronik för batteri och drivsystem. Den mest intressanta nykonstruktionen är givetvis batteriet. Det är av natrium-svavel-typ och har, jämfört med ett blybatteri, fyra gånger högre energiinnehåll per viktenhet. ",,31400,34100,,,,1867,,1,2,2,1988,,2,NA,NA,ABB ; ABB ; 9363002,,NA,ABB,NA,Asea Brown Bovery,,NA,NA,NA,1973,NA,NA,NA,NA,NA,NA,7,,,,,,,,,Högre energitäthet; högre livslängd (anges motsvara mellan 10 000 och 20 000 mil); underhållsfri konstruktoin; påverkas inte av vibrationer i fordonet;enkel laddning av bilar; små dimensioner; kapaciteten påveras inte av yttertemperaturen,,NA,,,,,,NA,NA,,NA,,,NA,,,NA,,,NA,,,NA,,,NA,,NA,,NA,,NA,,NA,,NA,,NA,,NA,,NA,,NA,,NA,,NA,,NA,,NA,1 ; Ny Teknik ;  ; 1988 ; 32 ; 5 ; ,1 ; Verkstäderna ;  ; 1990 ; 10 ; 75-76 ; ,1 ; Verkstäderna ;  ; 1992 ; 6-7 ; 56-58 ; ,2 ; Teknik iTRANSPORT ;  ; 1990 ; 7 ; 36 ; ,1 ; Teknik iTRANSPORT ;  ; 1990 ; 7 ; 41-42 ; ,,,,,,,,,,,,,NA
SWINNO - updated,8405001,,,Specialrobot som klarar av att lägga en jämn sträng av flytande tätningsmassa. ,,29569,28,29,31,34,1875,,1,2,2,1988,,2,NA,NA,FMS AB ; FMS ; 7407002,Västerås,NA,,NA,,,NA,NA,NA,NA,NA,35,36,NA,NA,NA,3,7,,,,,,,,Hastigheten kan ändras utan att resultatet blir lidande. ,,NA,,,,,,NA,NA,,NA,,,NA,,,NA,,,NA,,,NA,,,NA,,NA,,NA,,NA,,NA,,NA,,NA,,NA,,NA,,NA,,NA,,NA,,NA,,NA,1 ; Ny Teknik ;  ; 1988 ; 42 ; 26 ; ,,,,,,,,,,,,,,,,,NA
SWINNO - updated,9472001,Comwood column,,Limträstolpar. ,Chemical and Plastics,20102,45,,,,1886,,1,3,3,1988,,1,2,NA,Marstinsons AB ; Marstinsons ; 8474002,Bygdsiljum,NA,,NA,,,NA,NA,NA,1980,NA,NA,NA,NA,NA,NA,3,5a,,,,,,,,,,NA,,,,,,NA,NA,,NA,,,NA,,,NA,,,NA,,,NA,,,NA,,NA,,NA,,NA,,NA,,NA,,NA,,NA,,NA,,NA,,NA,,NA,,NA,,NA,1 ; Svensk Trävaru och Pappersmassetidning ;  ; 1988 ; 8 ; 8-9 ; ,,,,,,,,,,,,,,,,,NA
SWINNO - updated,10275001,,,"Förlackerad stålplåt. Det finns många fördelar med förlackerad plåt, både för miljön och tillverkningsprocessen. Verkstadsindustriernas lokala miljöproblem minksar, eftersom de egna målerierna kan läggas ned, samtidigt som brandrisken reduceras. Vidare kan tillverkningen rationaliseras, då en del av operationerna försvinner. Detta innebär förkortad genomloppstid, vilket i sin tur reducerar lagringskostnaderna. Den förlackerade plåten har jämnare kvalitet än den sprut- och pulverlackerade, vilket ökar produkternas livslängd. Den främsta anledningen är att både förbehandlings- och lackskikten läggs på med större noggrannhet. Den förlackerade plåten ger även teknikerna möjligheter att förenkla konstruktionerna.",,27100,28,29,34,35,1894,,1,3,3,1988,,3,NA,NA,Korrugal AB ; Korrugal ; 9277002,Finspång,NA,,NA,,,NA,NA,NA,NA,NA,NA,NA,NA,NA,NA,4,,,,,,,,,,,NA,,,,,,NA,NA,,NA,,,NA,,,NA,,,NA,,,NA,,,NA,,NA,,NA,,NA,,NA,,NA,,NA,,NA,,NA,,NA,,NA,,NA,,NA,,NA,1 ; Verkstäderna ;  ; 1988 ; 2 ; 12-14 ; ,,,,,,,,,,,,,,,,,NA
SWINNO - updated,10615001,Isolen,,Isoleringsmaterial baserat på torv och plast. Innovationen kom till genom att ett miljöföretag (företaget) vände sig till institutionen för kemi på Umeå universitet med en förfrågan om de kunde hjälpa till att ta tillvara färgrester.,,25240,45,,,,1897,,1,3,2,1988,Miljövårdscenter AB,1,2,1,Miljövårdscenter AB ; Miljövårdscenter ; 9617002,Sollefteå,NA,,NA,,,NA,NA,NA,1986,NA,NA,NA,NA,NA,NA,5b,1b,12,,,,,,,,,1,,,,Umeå universitet,,NA,1,Umeå Universitet ; Umeå universitet ; 13441002,11,SWE,,NA,,,NA,,,NA,,,NA,,,NA,,NA,,NA,,NA,,NA,,NA,,NA,,NA,,NA,,NA,,NA,,NA,,NA,,NA,1 ; VVS & Energi ;  ; 1988 ; 2 ; 12 ; ,,,,,,,,,,,,,,,,,NA
SWINNO - updated,10616001,,,Miljövänlig utsugningsutrustning. ,,29230,45,-100,,,1898,,1,2,2,1988,,3,NA,NA,Plymoth AB ; Plymoth ; 9618002,Malmö,NA,,NA,,,NA,NA,NA,NA,NA,NA,NA,NA,NA,NA,7,,,,,,,,,,,NA,,,,,,NA,NA,,NA,,,NA,,,NA,,,NA,,,NA,,,NA,,NA,,NA,,NA,,NA,,NA,,NA,,NA,,NA,,NA,,NA,,NA,,NA,,NA,1 ; VVS & Energi ;  ; 1988 ; 6 ; 11 ; ,,,,,,,,,,,,,,,,,NA
SWINNO - updated,8412001,Alby-processen,,"Metod. Albyprocessen innebär att de kemikalier som används ska återanvändas effektivare. Idag hamnar mycket i avloppet. Den innebär också att ämned kopparoxid kommer in i våtkemiprocessen samt att behovet av idag köpta kemikalier som natriumhydroxid minskar. I konventionell blekningsprocess får man farliga klorföreningar som restprodukt. med Albyprocessen får man kopparsulfid och en koncentrerad form av natriumhydroxid, kallad Albylut. Dena lut kan nu användas i hela massabrukets produktion. Genom den egna produktionen av Albylut blir hela processen lönsammare. ",,74202,211,,,,1919,,1,2,2,1989,,1,2,NA,Alby Systems ; Alby Systems ; 7414002,,NA,Stora Kemi,NA,,,NA,NA,NA,1986,NA,NA,NA,NA,NA,NA,2a,5a,1b,7,,,,,,Mindre miljöbelastning. ,,NA,,,,,,NA,NA,,NA,,,NA,,,NA,,,NA,,,NA,,,NA,,NA,,NA,,NA,,NA,,NA,,NA,,NA,,NA,,NA,,NA,,NA,,NA,,NA,1 ; Ny Teknik ;  ; 1989 ; 7 ; 14 ; ,,,,,,,,,,,,,,,,,NA
SWINNO - updated,8425001,,,"Instrument för tillståndskontroll av maskiner eller delar av maskiner. Haverier är i regel mycket kostsamma, med det här instrumentet kan företag kapa sina reparations- och stoppkostnader. Instrumentet fungerar som ett öra och lyssnar efter felljud. Från varje avlyssning, som kan ske kontinuerligt eller med vissa förutbestämda tidsintervall, samlar man upp data och bygger upp en karaktäristisk ljudbild.  Skillnaderna mellan dessa återkommande ljudbilder framträder tydligt och avikande ljud belyses. ",Machinery and Equipment,33200,-100,,,,1927,,1,2,2,1989,,1,2,NA,Keltronics AB ; Keltronics ; 7427002,Kiruna,NA,,1,,,NA,NA,NA,NA,NA,NA,NA,NA,NA,NA,19,5a,,,,,,,,,,1,Institutet för Rymdfysik (IRF),,,,,NA,NA,,NA,,,NA,,,NA,,,NA,,,NA,,,NA,,NA,,NA,,NA,,NA,,NA,,NA,,NA,,NA,,NA,,NA,,NA,,NA,,NA,1 ; Ny Teknik ;  ; 1989 ; 19 ; 42-43 ; ,,,,,,,,,,,,,,,,,NA
SWINNO - updated,8445001,,,"Ytbehandlingsmetod för plast som gör lösningmedel onödiga och därmed är mer miljövänlig. I korthet går metoden ut på en våtkemisk behandling av plastytan. En behandling som gör att själva ytan förändras. Plasten sänks ned i ett kemikaliebad under trettio till sextio sekunder. I badet sker en permanent förändring av ytan som gör att det är möjligt att senare behandla med lack, lim och tryckfärg utan att själva ytan måste prepareras med kemikalier.",,74202,252,,,,1943,,1,2,2,1989,,1,2,NA,PP Polymer AB ; PP Polymer ; 10007002,Spånga,NA,,NA,,,NA,NA,NA,NA,NA,NA,NA,NA,NA,NA,5a,12,7,,,,,,,Miljövänligt,,NA,,,,,,NA,NA,,NA,,,NA,,,NA,,,NA,,,NA,,,NA,,NA,,NA,,NA,,NA,,NA,,NA,,NA,,NA,,NA,,NA,,NA,,NA,,NA,1 ; Ny Teknik ;  ; 1990 ; 11 ; 25 ; ,1 ; Ny Teknik ;  ; 1994 ; 9 ; 14-15 ; ,5 ; Plastforum Scandinavia ;  ; 1990 ; 4 ; 14 ; ,1 ; Plastforum ;  ; 1995 ; 5 ; 14 ; ,4 ; Ytforum ;  ; 1990 ; 2 ; 47 ; ,,,,,,,,,,,,,NA
SWINNO - updated,8447001,,,Biologisk rening av förorenat vatten från klordioxidblekning av pappersmassa. Vid klordioxidblekning får man kloratjoner som biprodukt. Jonerna har visat sig ha dödande effekt på organismer i vatten utanför fabrikerna. Den nya innovationen är en metod med vilken en bakteria används för att rena det klorhaltiga avfallsvattnet. ,,74202,2111,24,,,1945,,1,2,2,1989,,1,2,NA,Anox ; Anox ; 7449002,Lund,NA,,1,,,NA,NA,NA,NA,NA,NA,NA,NA,NA,NA,5a,1b,1a,,,,,,,,,1,,,,Lunds universitet,,NA,NA,,NA,,,NA,,,NA,,,NA,,,NA,,,NA,,NA,,NA,,NA,,NA,,NA,,NA,,NA,,NA,,NA,,NA,,NA,,NA,,NA,1 ; Ny Teknik ;  ; 1990 ; 13 ; 32 ; ,,,,,,,,,,,,,,,,,NA
SWINNO - updated,8459001,,,"Ny teknik för att ta bort födelsemärken. Tekniken är betydligt enklare och billigare än att använda laser även om grundprincipen är densamma: intensiva ljusimpulser tränger genom huden in i de missprydande blodkärlen. Ljusenergin koagulerar blodvätksan, bränner sönder blodkropparna så att de förkolnar och kärlväggarna kollapsar. Med den nya tekniken hoppas lasern helt sonika över och det energirika ljuset leds direkt från blixturladdningslampan via fiberoptik ner i huden. Med en ljuspenna går det att ""pensla"" även tjockare kärl med en diameter på upp till ett par tiondels millimeter. ",Machinery and Equipment,33101,85,,,,1950,,1,2,2,1989,,1,2,NA,Medical Bio Care AB ; Medical Bio Care ; 7461002,Göteborg,NA,,NA,,,NA,NA,NA,1988,NA,NA,NA,NA,NA,NA,3,5a,,,,,,,,,,NA,,,,,,NA,NA,,NA,,,NA,,,NA,,,NA,,,NA,,,NA,,NA,,1,STU ; Styrelsen för teknisk utveckling ; 12398002,1,,NA,,NA,,NA,,NA,,NA,,NA,,NA,,NA,,NA,,NA,1 ; Ny Teknik ;  ; 1990 ; 50 ; 6 ; ,,,,,,,,,,,,,,,,,NA
SWINNO - updated,9480001,EF 70,,"Miljövänlig, klorfri massa som tillverkats med Lignox-metoden. ",Chemical and Plastics,21112,2112,,,,1958,,1,3,2,1989,,2,1,NA,Aspa Bruk ; Aspa Bruk ; 8482002,,1,,NA,,,NA,NA,NA,NA,NA,NA,NA,NA,NA,NA,7,20,5a,12,,,,,,Miljövänlig,Möjligt efter att ha adopterat ny process.,NA,,,,,,NA,NA,,NA,,,NA,,,NA,,,NA,,,NA,,,NA,,NA,,NA,,NA,,NA,,NA,,NA,,NA,,NA,,NA,,NA,,NA,,NA,,NA,2 ; Svensk Papperstidning ;  ; 1990 ; 18 ; 24-26 ; ,4 ; Svensk Papperstidning ;  ; 1990 ; 18 ; 25 ; ,,,,,,,,,,,,,,,,NA
SWINNO - updated,10278001,,,"Insprutningsmotor om 110 kW vid 5 500 r/min och 2,3 l cylindervolym. Motorn inleder en ny generation miljövänliga bensinmotorer och har tagit fem år att utveckla. Saabs tekniken anser att fyrcylindriga motorer har flera fördelar jmfört med sexcylindriga med motsvarande utförande och prestanda, bl a lägre vikt. Låg vikt uppges vara en av förutsättningarna för god balans, bra bränsleekonomi och höga totalprestanda. Tack vare det avancerade utförandet väger Saab-motorn endast 150 kg komplett med olja men utan bl a generator och styrservopump. Den nya 2,3 l motorn är vidare utrustad med det unika tändsystemet, Saab Direct Ignition. ",,34100,34100,,,,1961,,1,2,2,1989,,2,NA,NA,Saab-Scania ; Saab-Scania ; 5472002,,NA,,NA,,,NA,NA,NA,1984,NA,NA,NA,NA,NA,NA,20,5a,7,,,,,,,"Miljövänlig, lätt.",Utvecklad för att sitta i de egna bilarna.,NA,,,,,,NA,NA,,NA,,,NA,,,NA,,,NA,,,NA,,,NA,,NA,,NA,,NA,,NA,,NA,,NA,,NA,,NA,,NA,,NA,,NA,,NA,,NA,1 ; Verkstäderna ;  ; 1989 ; 12 ; 66 ; ,,,,,,,,,,,,,,,,,NA
SWINNO - updated,7492001,,,"Såg som gör det möjligt att ta tillvara övergrovt virke. Övergrovt virke går idag till massaindustrin för flisning eller blir liggande och ruttnar bort. Idén till den nya bandsågen med horisontellt liggande sågblad, där stocken ligger still och såghuvudet rör sig kommer från Tommy Nordin. Sågen kan skötas av en person. ",,29430,20,,,,1986,,1,2,2,1990,,1,2,NA,Seven Invest Trä AB ; Seven Invest Trä ; 6494002,Umeå,NA,,NA,Nordingrå Trä AB,,NA,NA,NA,1988,NA,NA,NA,NA,NA,NA,5a,7,,,,,,,,Tar tillvara övergrovt virke.,,NA,,,,,,NA,1,Nordingrå Trä AB ; Nordingrå Trä ; 13485002,17,SWE,Ådalens Plåt ; Ådalens Plåt ; 13787002,17,SWE,,NA,,,NA,,,NA,,,NA,,NA,,1,Utvecklingsfonden i Västernorrland ; Utvecklingsfonden i Västernorrland ; 12451002,4,,NA,,NA,,NA,,NA,,NA,,NA,,NA,,NA,,NA,,NA,1 ; Sågverken ;  ; 1990 ; 1 ; 41 ; ,,,,,,,,,,,,,,,,,NA
SWINNO - updated,8569001,,,"Lasersensor för optisk beröringsfri mätning. Grunden är en rektagulär, fotokänslig kiselplatta. Längs två motsående sidor sitter två elektroder. Just där en ljuspunkt träffar kiselplatan uppstår en elektrisk ström. Strömmen fördelar sig sedan till de båda elektroderna så att det blir mer ström till den närmaste och proportionellt mindre till den bortre. Laserpunktens läge på sensorplattan kan därmed bestämmas.",Machinery and Equipment,33400,33400,,,,1992,,1,2,1,1990,,1,NA,1,Sitek ; Sitek ; 9884002,,NA,,1,,,NA,NA,NA,NA,NA,NA,NA,NA,NA,NA,1a,,,,,Uppfinning av Torkel Wallmark.,,,,,,1,,,,Chalmers Tekniska Högskola,,NA,NA,,NA,,,NA,,,NA,,,NA,,,NA,,,NA,,NA,,NA,,NA,,NA,,NA,,NA,,NA,,NA,,NA,,NA,,NA,,NA,,NA,1 ; Ny Teknik ;  ; 1995 ; 43 ; 39 ; ,,,,,,,,,,,,,,,,,NA
SWINNO - updated,9479001,Delta-Screen,,"Sil för hög massakoncentration. Den nya silen är utrustad med specialutformade foils, som ger konstanta silningsförhållanden utmed hela silkorgen. Rejektförtjockningen elimineras nästan helt och ger möjlighet att använda silen vid högre massakoncentrationer och kapacitet. ",,29550,21,,,,1996,,1,2,2,1990,,2,NA,NA,Sunds Defibrator ; Sunds Defibrator ; 9970002,Sundsvall,NA,,NA,,,NA,NA,NA,NA,NA,NA,NA,NA,NA,NA,5a,7,,,,,,,,Ger konstanta silningsförhållanden utmed hela silkorgen. Rejektförtjockningen elimineras nästan helt. ,,NA,,,,,,NA,NA,,NA,,,NA,,,NA,,,NA,,,NA,,,NA,,NA,,NA,,NA,,NA,,NA,,NA,,NA,,NA,,NA,,NA,,NA,,NA,,NA,"1 ; Svensk Papperstidning ;  ; 1990 ; 10 ; 26-28,31 ; ",,,,,,,,,,,,,,,,,NA
SWINNO - updated,9481001,Super Batch,,"Kokningsteknik. Genom en mer selektiv delignifiering har man nått mål som bättre massastyrka, ökat massautbyte och delignering till lägre kappatal utan negativa konsekvenser. Batchkokning är det traditionella sättet att framställa sulfatmassa. ",,29550,21,,,,1997,,1,2,2,1990,,2,NA,NA,Sunds Defibrator ; Sunds Defibrator ; 9970002,Sundsvall,NA,,NA,,,NA,NA,NA,1988,NA,NA,NA,NA,NA,NA,7,5a,,,,,,,,"Bättre massastyrka, ökat massautbyte, lägre kappatal utan negativa konsekvenser.",,NA,,,,,,NA,NA,,NA,,,NA,,,NA,,,NA,,,NA,,,NA,,NA,,NA,,NA,,NA,,NA,,NA,,NA,,NA,,NA,,NA,,NA,,NA,,NA,"1 ; Svensk Papperstidning ;  ; 1991 ; 5 ; 24-26,29 ; ",,,,,,,,,,,,,,,,,NA
SWINNO - extension,12963001,ribbon-flow,,Ny miljövänlig teknik för beläggning av polyuretan.,Machinery and Equipment,28510,25,,,,2014,,1,2,2,1990,,2,2,0,Trelleborg ; Trelleborg ; 9775002,Trelleborg,NA,,NA,,,NA,NA,NA,NA,NA,NA,NA,NA,NA,NA,1b,12,7,,,,,,,,,NA,,,,,,NA,1,Stowe Woodward ; Stowe Woodward ; 13278002,18,USA,,NA,,,NA,,,NA,,,NA,,,NA,,NA,,NA,,NA,,NA,,NA,,NA,,NA,,NA,,NA,,NA,,NA,,NA,,NA,1 ; Svensk Papperstidning ;  ; 1990 ; 9 ; 7 ; ,,,,,,,,,,,,,,,,,NA
SWINNO - updated,5954001,High Tech 2000,,"Ny typ av utrustning - en framkallningsmaskin med inbyggd silveråtervinning som är avsedd att minska användningen av fotokemi, samtatt minska kostnaden för inköp och destruktion av framkallare och fix",Machinery and Equipment,33400,22,,,,2019,,1,1,1,1991,,1,NA,NA,Johan Saxeby AB ; Johan Saxeby ; 4956002,,NA,,NA,,,NA,NA,NA,NA,NA,NA,NA,NA,NA,NA,12,5a,7,,,,,,,Kostnadsbesparande för användaren,,NA,,,,,,NA,1,Reproteknik & Miljö AB ; Reproteknik & Miljö ; 13404002,17,SWE,,NA,,,NA,,,NA,,,NA,,,NA,,NA,,NA,,NA,,NA,,NA,,NA,,NA,,NA,,NA,,NA,,NA,,NA,,NA,"1 ; Aktuell Grafisk Information ;  ; 1991 ; 211 ; 44,46-47 ; ",,,,,,,,,,,,,,,,,NA
SWINNO - updated,6249001,SSA-5000,,"Analysatorinstrument för mätning och karaktärisering av fibrer och partiklar. Instrumentet bygger på en patenterad mätprincip som varken påverkas av förändringar i mediets färg eller ljushet. Instrumentet påverkas inte av variationer i partikelstorlek och fyllmedel. Retentionsmätning har utförts länge. Det nya med innovationen är dels signalanalysen och dels mätsondens utformning. Ljusstrålens diamter är endast 0,6 mm och mätgapet endast 15 mm. Det händer ofta att strålen inte träffar någon fiber. Transmissionens styrka bestäms då av koncentrationens finfraktion, som har visar sig vara rätt konstant vid varierande fiberkoncentration. ",Machinery and Equipment,33200,21,-100,,,2021,,1,2,2,1991,,2,NA,NA,BTG Källe Inventing AB ; BTG Källe Inventing ; 9816002,Säffle,NA,,NA,,,NA,NA,NA,NA,NA,NA,NA,NA,NA,NA,7,1b,,,,,,,,Bättre mätkvalitet.,,NA,,,,,,NA,NA,,NA,,,NA,,,NA,,,NA,,,NA,,,NA,,NA,,NA,,NA,,NA,,NA,,NA,,NA,,NA,,NA,,NA,,NA,,NA,,NA,3 ; Automation ;  ; 1991 ; 3 ; 41 ; ,1 ; Svensk Papperstidning ;  ; 1993 ; 6 ; 122 ; ,,,,,,,,,,,,,,,,NA
SWINNO - updated,6550001,Sofix,,Kontaktsystem som efterträder Europadonet. Det nya donet ska användas både i industrimiljö och för telekommunikation. Donet ser ut att bli den dominerande standarden för bakplanskontakter i framtiden. ,,32100,32,,,,2029,"Marknadsförs av DuPont, Holland, då under namnet Metral.",1,2,2,1991,,2,2,NA,Ericsson ; Ericsson ; 7441002,,NA,Ericsson,NA,,,NA,NA,NA,NA,NA,NA,NA,NA,NA,NA,7,2a,,,,,,,,,,NA,,,,,,NA,1,DuPont ; DuPont ; 13046002,18,NLD,,NA,,,NA,,,NA,,,NA,,,NA,,NA,,NA,,NA,,NA,,NA,,NA,,NA,,NA,,NA,,NA,,NA,,NA,,NA,1 ; Elteknik ;  ; 1991 ; 6 ; 40-41 ; ,,,,,,,,,,,,,,,,,NA
SWINNO - updated,6556001,NMT-mini,,Datainsamlingsenhet för platser som bara kan nås via mobiltelefonnätet. Enheten kan användas för regelbunden överföring av mätdata eller för att ringa upp vid larm. Systemet utveckaldes för att miljövårdsmyndigheterna krävde att Göteborgs kommun skulle kontrolelra att inte avloppsvattnet rann ut orenat i naturen. Systemet ringer själv upp om det detekterar ovanligt höga halter. ,,32200,751,742,,,2035,,1,2,2,1991,Göteborgs VA-verk,1,2,NA,Cactus ; Cactus ; 5558002,Göteborg,NA,,NA,,,NA,NA,NA,NA,NA,NA,NA,NA,NA,NA,20,2a,,,,,,,,,Utvecklad på uppdrag av Göteborgs VA-verk.,NA,,,,,,NA,NA,,NA,,,NA,,,NA,,,NA,,,NA,,,NA,,NA,,NA,,NA,,NA,,NA,,NA,,NA,,NA,,NA,,NA,,NA,,NA,,NA,1 ; Elteknik ;  ; 1991 ; 13 ; 27 ; ,,,,,,,,,,,,,,,,,NA
SWINNO - updated,6562001,Diodair,,"Gasmätare för mätning av gaser med hjälp av laserdioder. Den främsta fördelen med att mäta gaser med laserdioder är den korta reaktionstiden. De metoder som hittills har använts inom processindustrin ger mycket långsammare svar. Laserdiodtekniken kan användas för att styra processen direkt vilket ofta var svårt eller omöjligt tidigare, med de metoder som kan användas i industrimiljö. ",Machinery and Equipment,33200,21,15,20,23,2041,Företaget köptes upp av Saab Missiles för att tillföra Missiles civila verksamheter. I samband med detta döptes produkten om till Saab Diodair 2000.,1,2,1,1991,,1,2,NA,Altoptronic ; Altoptronic ; 5564002,Göteborg,NA,Saab Missiles Industrial Systems,1,,,NA,NA,NA,NA,NA,24,25,26,NA,NA,1b,7,,,,,Ny kombination av tekniker. ,,,,,1,,,,Chalmers,,NA,1,Institutet för Mikroelektronik ; Institutet för Mikroelektronik ; 9676002,14,SWE,,NA,,,NA,,,NA,,,NA,,,NA,,NA,,NA,,NA,,NA,,NA,,NA,,NA,,NA,,NA,,NA,,NA,,NA,,NA,1 ; Elteknik ;  ; 1991 ; 18 ; 18-19 ; ,2 ; Elektroniktidningen ;  ; 1992 ; 3 ; 33 ; ,,,,,,,,,,,,,,,,NA
SWINNO - updated,7046001,Texoplast,,"Saltlösning som ingår i en miljövänlig metod att flamskydda textilier. Bland annat kan bomullstyg som är uppblandade med syntetiska material flamskydas, vilket vissa anra flamskyddsmedel inte klarar.",,24140,-100,,,,2045,,1,3,2,1991,,1,NA,NA,Texoplast ; Texoplast ; 6048002,Göteborg,NA,,NA,,,NA,NA,NA,NA,NA,NA,NA,NA,NA,NA,12,7,,,,,,,,Säkerhet; kan även flamskydda bomullstyg; färger och mönster håller sig intakta,,NA,,,,,,NA,NA,,NA,,,NA,,,NA,,,NA,,,NA,,,NA,,NA,,NA,,NA,,NA,,NA,,NA,,NA,,NA,,NA,,NA,,NA,,NA,,NA,1 ; Kemisk Tidskrift ;  ; 1991 ; 4 ; 12 ; ,,,,,,,,,,,,,,,,,NA
SWINNO - updated,7069001,BiaCore,,Biosensor.,Machinery and Equipment,33200,,,,,2049,,1,NA,NA,1991,,2,NA,1,Pharmacia AB ; Pharmacia ; 9978002,,NA,,NA,,,NA,NA,NA,NA,NA,NA,NA,NA,NA,NA,,,,,,,,,,,,NA,,,,,,NA,NA,,NA,,,NA,,,NA,,,NA,,,NA,,,NA,,NA,,NA,,NA,,NA,,NA,,NA,,NA,,NA,,NA,,NA,,NA,,NA,,NA,2 ; Kemisk Tidskrift ;  ; 1994 ; 7 ; 56 ; ,,,,,,,,,,,,,,,,,NA
SWINNO - updated,7494001,Safe-T-Cut,,"Sprängklämma för säker kapning av kullblåsta träd. Tekniken går ut på att klämman, med en invändigt fäst sprängladdning, förs upp i trädet med hjälp av en teleskopisk glasfibertång och sedan kläms fast kring trädet där man vill kapa det. Det går även bra att aptera klämman med en kvistningsstång, som del flesta kraftdistributörer har tillgång till. Redan innan klämman förs upp i trädet har en adapter och en förlängningsstubin fästs vid den, så att det sedan är enkelt att på behörigt avstånd detonera sprängladdningen med en tändapparat. Laddningen består av pentyl och är exempelvis 15 gånger starkare än den dynamit som används inom det militära. En fördel med att all kraft går in i stammen är att man kan spränga mycket nära ledningsstolpar utan att skada dem. ",,24610,2,45212,,,2053,Tillverkas av Safac i Vindeln.,1,2,2,1991,,1,2,NA,Explosiv utveckling ; Explosiv utveckling ; 6496002,,NA,,1,,,NA,NA,NA,1990,NA,NA,NA,NA,NA,NA,5a,5b,,,,,,,Farligt arbete vid röjning efter storm.,,,NA,,,,,,NA,1,Explosiva varor AB ; Explosiva varor ; 13089002,17,SWE,,NA,,,NA,,,NA,,,NA,,,NA,,NA,,NA,,NA,,NA,,NA,,NA,,NA,,NA,,NA,,NA,,NA,,NA,,NA,1 ; Sågverken ;  ; 1991 ; 1 ; 38-39 ; ,1 ; Ny Teknik ;  ; 2005 ; 4 ; 8 ; ,,,,,,,,,,,,,,,,NA
SWINNO - updated,7497001,Scorpion,,"Fordon konstruerat för skogsbruk och skotning av virke. Scorpion har 8 hjul och driver på de fyra främre och har hjälpdrift på det bakre hjulparet, som ska användas när ekipaget eventuellt kört fast. Maxhastigheten är 18 km/h vid användandet av bakre hjulparet 5 km/h. Scorpion har en hydraulisk griplastare för lastning och lossning. Styrs gör den med en hydraulisk joystick. Maskinen är liten, smidig och lättransporterad. ",,29320,2,,,,2055,,1,2,2,1991,,2,NA,NA,Jonsered Motor ; Jonsered Motor ; 6499002,,NA,,NA,,,NA,NA,NA,NA,NA,NA,NA,NA,NA,NA,5a,7,,,,,,,,"Liten, smidig.",,NA,,,,,,NA,1,EMT-Trac ; EMT-Trac ; 13487002,17,SWE,,NA,,,NA,,,NA,,,NA,,,NA,,NA,,NA,,NA,,NA,,NA,,NA,,NA,,NA,,NA,,NA,,NA,,NA,,NA,1 ; Sågverken ;  ; 1991 ; 2 ; 40 ; ,,,,,,,,,,,,,,,,,NA
SWINNO - updated,10289001,,,"Gasturbin i vilken temperaturen och därmed också utsläppen minskar. Tekniken är en s k torr, låg NOX-teknologi; gasen blandas med luften innan den bränns. Innovationen har tillkommit efter efterfrågan på mer miljövänliga gasturbiner för oljeplattformar. Problemet har varit de höga utsläppsnivåerna av koldioxid och kväveoxider. Innovationen består i ett kombinerat kraftverk med både ång- och gasturbin.",,29110,11,,,,2073,,1,2,2,1991,,2,NA,NA,ABB Stal ; ABB Stal ; 10263002,Finspång,NA,ABB,NA,,,NA,NA,NA,NA,NA,NA,NA,NA,NA,NA,4,12,5a,,,,,,,,,NA,,,,,,NA,NA,,NA,,,NA,,,NA,,,NA,,,NA,,,NA,,NA,,NA,,NA,,NA,,NA,,NA,,NA,,NA,,NA,,NA,,NA,,NA,,NA,1 ; Verkstäderna ;  ; 1991 ; 14 ; 40 ; ,,,,,,,,,,,,,,,,,NA
SWINNO - updated,8475001,,,"Skrivare för blindskrift som tar emot infromation från datorn och lagrar den i sitt interminne. Panelen är av strängsprutad aluminium, elektroniken är byggd i moduler och vid service kan kretskorten lätt bytas.",,30020,101,,,,2112,,1,1,1,1992,,1,NA,NA,Index Braille Printer Company ; Index Braille Printer Company ; 7477002,Osby,NA,,NA,,,NA,NA,NA,NA,NA,NA,NA,NA,NA,NA,4,5a,3,,,,,,,,,NA,,,,,,NA,NA,,NA,,,NA,,,NA,,,NA,,,NA,,,NA,,NA,,NA,,NA,,NA,,NA,,NA,,NA,,NA,,NA,,NA,,NA,,NA,,NA,1 ; Ny Teknik ;  ; 1992 ; 13 ; 28 ; ,,,,,,,,,,,,,,,,,NA
SWINNO - updated,8476001,,,"Tillbehörssats till golvbrunnar som förhindrar avdunstning och dålig lukt. Illbehörssatsen består av ett trattliknande lock av polypropenplast, gummipackning, ventilboll och klämring. Bollen har en sådan densitet att den alltid flyter upp mot tätringen i trattröret, men så fort vatten rinner till uppifrån trängs den undan och låter vattnet passera. På det här sättet kommer golvbrunnens annars vanligen fria attenyta inte i kontakt med luften.",,25240,25240,28751,101,,2113,,1,2,3,1992,,NA,NA,NA,Nordgro AB ; Nordgro ; 7478002,,1,,NA,,,NA,NA,NA,NA,NA,NA,NA,NA,NA,NA,5b,,,,,,,,"Golvbrunnar avgav tidigare dålig lukt, röta i bjälklag och kunde orsaka översvämningar",,,NA,,,,,,NA,NA,,NA,,,NA,,,NA,,,NA,,,NA,,,NA,,NA,,NA,,NA,,NA,,NA,,NA,,NA,,NA,,NA,,NA,,NA,,NA,,NA,1 ; Ny Teknik ;  ; 1992 ; 16 ; 13 ; ,,,,,,,,,,,,,,,,,NA
