SWINNO - updated,7440001,,,"Trämelass. Trämelassen består av de mest lättlösliga substanserna i vedråvaran för skivframställning, vilka går i lösning i tillverkningsprocessen och inblandas i processvattnet. Sedan mitten av 1960-talet återvinnes substanserna, koncentreras och torkas samt ges en viss efterbehandling som gör dem lämpliga som bl a kreatursfoder. Produkten är alltså dels rent kreatursfoder och dels en ingående ingredients i kreatursfoder.",Textile,15710,12,,,,893,,1,3,3,1979,,1,2,NA,Assi ; Assi ; 9968002,Skinnskatteberg,NA,,NA,,,NA,NA,NA,NA,NA,NA,NA,NA,NA,NA,19,5a,,,,,,,,,,NA,,,,,,NA,NA,,NA,,,NA,,,NA,,,NA,,,NA,,,NA,,NA,,NA,,NA,,NA,,NA,,NA,,NA,,NA,,NA,,NA,,NA,,NA,,NA,1 ; Sågverken ;  ; 1979 ; 11 ; 790-793 ; ,1 ; Kemisk Tidskrift ;  ; 1979 ; 9 ; 92-93 ; ,,,,,,,,,,,,,,,,NA
SWINNO - updated,7447001,Skogsjan,,Gripprocessor. ,,29320,2,,,,894,http://sv.wikipedia.org/wiki/Skogsjan_AB,1,2,2,1979,,NA,NA,NA,Skogsjan AB ; Skogsjan ; 10055002,Österfärnebo (Söderhamn?),NA,,NA,,,NA,NA,NA,NA,NA,NA,NA,NA,NA,NA,7,5a,,,,,,,,,,NA,,,,,,NA,NA,,NA,,,NA,,,NA,,,NA,,,NA,,,NA,,NA,,NA,,NA,,NA,,NA,,NA,,NA,,NA,,NA,,NA,,NA,,NA,,NA,1 ; Sågverken ;  ; 1981 ; 10 ; 67 ; ,,,,,,,,,,,,,,,,,NA
SWINNO - updated,7915001,,,Balk av konstruktionsboard och kanter av trä.,Chemical and Plastics,20301,452,,,,897,,1,3,3,1979,,1,NA,NA,Masonite AB ; Masonite ; 10097002,,NA,,NA,,,NA,NA,NA,NA,NA,NA,NA,NA,NA,NA,3,3,,,,,,,,,,NA,,,,,,NA,NA,,NA,,,NA,,,NA,,,NA,,,NA,,,NA,,NA,,NA,,NA,,NA,,NA,,NA,,NA,,NA,,NA,,NA,,NA,,NA,,NA,1 ; Ny Teknik ;  ; 1979 ; 9 ; 4 ; ,,,,,,,,,,,,,,,,,NA
SWINNO - updated,7926001,Loadmaster Computer B 20,,Instrument för uträkning av hur lasten på ett fartyg ska fördelas. Instrumentet bygger på en mikrodator med bildskärm och skrivare. Instrumentet är ämnad för ro-ro- och containerfartyg. ,,30020,611,612,,,907,,1,2,3,1979,,3,NA,NA,Kockums AB ; Kockums ; 7950002,,NA,Kockums AB,NA,,,NA,NA,NA,NA,NA,NA,NA,NA,NA,NA,7,,,,,,,,,,,NA,,,,,,NA,NA,,NA,,,NA,,,NA,,,NA,,,NA,,,NA,,NA,,NA,,NA,,NA,,NA,,NA,,NA,,NA,,NA,,NA,,NA,,NA,,NA,1 ; Ny Teknik ;  ; 1979 ; 29 ; 20 ; ,,,,,,,,,,,,,,,,,NA
SWINNO - updated,7932001,Tubmataren,,Tubmatare för hantering av flis i massaindustrin. Innovationen består av en skruvmatare som löper inuti en cylinder. Tack vare att mataren är skyddad så belastas den inte av godset runt omkring. ,Machinery and Equipment,28740,2111,632,,,912,,1,2,3,1979,,1,2,NA,Kilsverken ; Kilsverken ; 6934002,Billingsfors,1,,NA,,,NA,NA,NA,1977,NA,NA,NA,NA,NA,NA,5a,5b,7,,,,,,,,,NA,,,,,,NA,NA,,NA,,,NA,,,NA,,,NA,,,NA,,,NA,,NA,,NA,,NA,,NA,,NA,,NA,,NA,,NA,,NA,,NA,,NA,,NA,,NA,1 ; Ny Teknik ;  ; 1979 ; 37 ; 4 ; ,,,,,,,,,,,,,,,,,NA
SWINNO - updated,7937001,,,Lösningsmedel med låg halvt av aromater. Den låga aromathalten innebär att lösningsmedlet är miljövänligare än många andra på marknaden. ,,24300,454,101,,,913,,1,3,2,1979,,1,2,1,Asea Isolation ; Asea Isolation ; 10100002,Piteå,NA,Asea,NA,,,NA,NA,NA,NA,NA,NA,NA,NA,NA,NA,7,5a,,,,,,,,,,NA,,,,,,NA,NA,,NA,,,NA,,,NA,,,NA,,,NA,,,NA,,NA,,NA,,NA,,NA,,NA,,NA,,NA,,NA,,NA,,NA,,NA,,NA,,NA,1 ; Ny Teknik ;  ; 1979 ; 40 ; 7 ; ,,,,,,,,,,,,,,,,,NA
SWINNO - updated,7939001,,,"Träduppdragare; ett hydrauliskt redskap som greppar tag, bryter upp och skalar rotgrenar av trädet. Med den nya tekniken kan 25 % mer av skogen tas om handl ",,29320,2013,,,,915,,1,2,3,1979,,1,2,1,Elektro-Diesel AB ; Elektro-Diesel ; 10039002,Kiruna,NA,,NA,,,NA,NA,NA,1967,NA,NA,NA,NA,NA,NA,5a,1b,,,,,,,,,,NA,,,,,,NA,NA,,NA,,,NA,,,NA,,,NA,,,NA,,,NA,,NA,,NA,,NA,,NA,,NA,,NA,,NA,,NA,,NA,,NA,,NA,,NA,,NA,1 ; Ny Teknik ;  ; 1979 ; 40 ; 32 ; ,,,,,,,,,,,,,,,,,NA
SWINNO - updated,7962001,Macs,,"Metod för att säkrare mäta bultförbands klämkraft. Den säkrare åtdragningstekniken kan göra bultförbanden lättare, vilket påverkar hela bilkonstruktionen. En lättare bil är en bensinsnålare bil, något hela bilindustrin eftersträvar. Åtdragningssystemet är mikrodatorbaserat. ",,29569,34,,,,920,,1,2,2,1979,,2,2,NA,Atlas Copco AB ; Atlas Copco ; 9764002,,NA,,NA,,,NA,NA,NA,NA,NA,NA,NA,NA,NA,NA,7,,,,,,,,,"Säkrare, lättare bilar",,NA,,,,,,NA,NA,,NA,,,NA,,,NA,,,NA,,,NA,,,NA,,NA,,NA,,NA,,NA,,NA,,NA,,NA,,NA,,NA,,NA,,NA,,NA,,NA,1 ; Ny Teknik ;  ; 1980 ; 17 ; 12 ; ,1 ; Verkstäderna ;  ; 1979 ; 9 ; 27-30 ; ,,,,,,,,,,,,,,,,NA
SWINNO - updated,8082001,Thermovedpannan,,"Värmepanna som uppges ha nästan dubbla verkningsgraden och en tiondel av miljöfarliga utsläpp jämfört med en vanlig vedpanna. Istället för att vattenmagasinet direkt omger eldstaden finns där ett skikt av eldfast keramik. Keramikens värmeisolerande förmåga för att förbränningstemperaturen kommer upp till 1300 C. Hög temperatur ger mer fullständig förbränning, energiinnehållet i veden utnyttjas bättre. ",Machinery and Equipment,28220,101,,,,922,,1,2,2,1979,,1,2,NA,Thermoved ; Thermoved ; 7084002,Malmö,NA,,NA,,,NA,NA,NA,1978,NA,NA,NA,NA,NA,NA,7,,,,,,,,,"Dubbel verkningsgrad relativt andra pannor, mindre miljöfarliga utsläpp. ",,NA,,,,,,NA,NA,,NA,,,NA,,,NA,,,NA,,,NA,,,NA,,NA,,NA,,NA,,NA,,NA,,NA,,NA,,NA,,NA,,NA,,NA,,NA,,NA,1 ; Ny Teknik ;  ; 1981 ; 46 ; 14 ; ,,,,,,,,,,,,,,,,,NA
SWINNO - updated,9576001,Väv-Kalle,,"Kasettvävstol som består av en grundstomme med trampanordning. På stommen läggs en kassett som innehåler varpbom, träckbom, lättmetallskaft med stålsolv, skedlag, bröstbom och tygbom. Om man har tre kasetter innebär det att man kan göra undervisning i tre pass om dagen på samma yta som man tidigare körde ett. ",,29540,172,,,,930,Carl Lindstam,1,1,2,1979,,2,NA,1,Stabil ; Stabil ; 8578002,,1,,NA,,,NA,NA,NA,NA,NA,NA,NA,NA,NA,NA,5b,7,,,,,,,,,,NA,,,,,,NA,NA,,NA,,,NA,,,NA,,,NA,,,NA,,,NA,,NA,,NA,,NA,,NA,,NA,,NA,,NA,,NA,,NA,,NA,,NA,,NA,,NA,1 ; Textil och konfektion ;  ; 1979 ; 7 ; 15 ; ,,,,,,,,,,,,,,,,,NA
SWINNO - updated,9825001,,,Nickel/järn-batteri för elbilar med ungefär dubbelt så hög energitäthet jämfört med ett blybatteri. Ökningen av energitätheten medför en ökning av körsträckan med ungefär lika mycket.,,31400,,,,,932,,1,2,2,1979,,1,NA,NA,Svenska utvecklings AB ; Svenska utvecklings ; 8827002,,NA,,NA,,,NA,NA,NA,NA,NA,NA,NA,NA,NA,NA,,,,,,,,,,,,NA,,,,,,NA,NA,,NA,,,NA,,,NA,,,NA,,,NA,,,NA,,NA,,NA,,NA,,NA,,NA,,NA,,NA,,NA,,NA,,NA,,NA,,NA,,NA,"1 ; Transport Teknik ;  ; 1979 ; 10 ; 312-313,317 ; ",,,,,,,,,,,,,,,,,NA
SWINNO - updated,10137001,Repak,,"Råmaterial som framställs ur spill och avfall från förpackningsindustrin. Materialet är en plastsprutmassa för den plastbearbetande industrin, som kan ge betydande kostnadsbesparingar inom den internationella förpackningsindustrin. Materialet är slagsegt, fuktstabilt och har god hållfasthet. Man har tillverkat bl a bobiner, sprängsprutade rör, s k plank för lastbilar och formsprutade lådor med gott resultat. Metoden innebär att man avstår från att separera de olika komponenterna från varandra. Istället förvandlas avfallet till ett granulat, vilket kan bearbetas som ett plastmaterial.",Chemical and Plastics,21250,25,28,,,939,,1,3,2,1979,,1,2,NA,Åkerlund & Rausing ; Åkerlund & Rausing ; 10015002,Lund,NA,,NA,,,NA,NA,NA,NA,NA,NA,NA,NA,NA,NA,19,,,,,,,,,,,NA,,,,,,NA,NA,,NA,,,NA,,,NA,,,NA,,,NA,,,NA,,NA,,NA,,NA,,NA,,NA,,NA,,NA,,NA,,NA,,NA,,NA,,NA,,NA,1 ; Verkstäderna ;  ; 1979 ; 6 ; 48 ; ,,,,,,,,,,,,,,,,,NA
SWINNO - updated,10139001,,,"Snabbtelefonsystem. Systemet är miljöanpasst, dvs det finns apparater som kan användas i våtutrymmen, verkstäder, lokaler med explosiva gaser, kontor eller chefsrum(!). ",,32200,-100,,,,941,,1,2,2,1979,,3,NA,NA,Standard Radio & Telefon AB ; Standard Radio & Telefon ; 9880002,Södertälje,NA,,NA,,,NA,NA,NA,NA,NA,NA,NA,NA,NA,NA,7,,,,,,,,,Miljöanpassad,,NA,,,,,,NA,NA,,NA,,,NA,,,NA,,,NA,,,NA,,,NA,,NA,,NA,,NA,,NA,,NA,,NA,,NA,,NA,,NA,,NA,,NA,,NA,,NA,1 ; Verkstäderna ;  ; 1979 ; 7 ; 55 ; ,,,,,,,,,,,,,,,,,NA
SWINNO - updated,10145001,,,"Ny metod för att på ett effektivare sätt utnyttja bark, torv, träavfall m.m. som bränsle. ",,74202,-100,,,,946,,1,2,2,1979,,2,2,NA,AB Svenska Fläktfabriken ; Svenska Fläktfabriken ; 9949002,,NA,,NA,,,NA,NA,NA,NA,NA,NA,NA,NA,NA,NA,1b,5a,,,,,,,,,,NA,,,,,,NA,NA,,NA,,,NA,,,NA,,,NA,,,NA,,,NA,,NA,,NA,,NA,,NA,,NA,,NA,,NA,,NA,,NA,,NA,,NA,,NA,,NA,1 ; Verkstäderna ;  ; 1979 ; 12 ; 70 ; ,,,,,,,,,,,,,,,,,NA
SWINNO - updated,10148001,,,"Station för inmätning av timmer. Mätningen av timmer kan nu utföras i uppvärmd lokal med rätt belysning. Stor vikt har lagts vid den ergonomiska utformningen av arbetsplatsen. Stationen kännetecknas av en ombonad arbetsmiljö. Bländfri belysning, låg bullernivå och rätt arbetshöjd på mätbordet. ",,29430,2021,20101,,,948,Säljs av Datadon.,1,2,2,1979,,2,NA,NA,Alnö Mekaniska Verkstad ; Alnö Mekaniska Verkstad ; 10259002,Sundsvall,NA,,NA,,,NA,NA,NA,NA,NA,NA,NA,NA,NA,NA,5a,7,,,,,,,,Arbetsförhållanden förbättrade. ,,NA,,,,,,NA,NA,,NA,,,NA,,,NA,,,NA,,,NA,,,NA,,NA,,NA,,NA,,NA,,NA,,NA,,NA,,NA,,NA,,NA,,NA,,NA,,NA,5 ; Verkstäderna ;  ; 1979 ; 15 ; 16 ; ,1 ; Kemisk Tidskrift ;  ; 1979 ; 13 ; 110 ; ,,,,,,,,,,,,,,,,NA
SWINNO - updated,6110001,,,Teknik för ångtorkning av pappersmassa. Tekniken kan minska nettoförbrukningen av värme med 75 % och produktionskonstnaden för salumassa med 50 kronor per ton.,,74202,211,,,,963,Samarbete med professor Bengt Hedström på Chalmers.,1,2,2,1980,,1,NA,NA,MoDo-Chemetics AB ; MoDo-Chemetics ; 9783002,Örnsköldsvik,NA,MoDo,NA,,,NA,NA,NA,NA,1978,NA,NA,NA,NA,NA,3,,,,,,,,,,,NA,,,,,,NA,1,Chalmers ; Chalmers ; 11262002,11,SWE,,NA,,,NA,,,NA,,,NA,,,NA,,NA,,NA,,NA,,NA,,NA,,NA,,NA,,NA,,NA,,NA,,NA,,NA,,NA,"1 ; Automation ;  ; 1980 ; 2 ; 41-42,44 ; ",,,,,,,,,,,,,,,,,NA
SWINNO - updated,6115001,,,"Lastindikator som visar vikt och axeltryck för varje fordonskombination. Tryck och vikt visas med tre siffror i hela och tiondels ton. Larm ges vid överlast. Indikatorn baseras på PRESSDUKTOR-givaren, en nu snart 30-årig Asea-uppfinning, som tjänstgör i hårda miljöer, bl. a. i stålverk. Den givare som utvecklats för indikatorn blev färdig 1977. ",Machinery and Equipment,33200,60,631,,,968,,1,2,2,1980,,3,NA,NA,Asea ; Asea ; 9755002,,NA,Asea,NA,,,NA,NA,NA,NA,1977,NA,NA,NA,NA,NA,7,,,,,,,,,,,NA,,,,,,NA,NA,,NA,,,NA,,,NA,,,NA,,,NA,,,NA,,NA,,NA,,NA,,NA,,NA,,NA,,NA,,NA,,NA,,NA,,NA,,NA,,NA,1 ; Automation ;  ; 1980 ; 5 ; 53-54 ; ,,,,,,,,,,,,,,,,,NA
SWINNO - updated,6116001,Econobox,,"Sprutbox som möjliggör värmeåtervinninge. En av grundtankarna med Econobox ligger i att begränsa kontakttiden luft/vatten till ett minimum och därigenom undvika att frånluften kyls ned under den tid målningsarbete inte pågår -normalt 70-80 % av den totala drifttiden. Detta kan arrangeras på olika sätt. I det enklaste fallet stoppas helt enkelt vattenridån automatiskt då sprutpistolen stängs av. Med system Econobox arbetar sprutboxen ""vått"" bara under den krota tid då sprutarbete pågår och med maximal värmeåtervining resten av tiden. ",,29240,285,361,,,969,,1,2,2,1980,,2,2,NA,AB Carl Munters ; Carl Munters ; 9786002,,NA,Incentivegruppen,NA,,,NA,NA,NA,NA,NA,NA,NA,NA,NA,NA,7,,,,,,,,,,,NA,,,,,,NA,NA,,NA,,,NA,,,NA,,,NA,,,NA,,,NA,,NA,,NA,,NA,,NA,,NA,,NA,,NA,,NA,,NA,,NA,,NA,,NA,,NA,1 ; Automation ;  ; 1980 ; 6 ; 21 ; ,,,,,,,,,,,,,,,,,NA
SWINNO - updated,6726001,Carbogel,,"Miljövänligt, kolbaserat bränslesystem. En stabil kol/vattenslurry. Carbogel är en kolbaserad produkt med oljeliknande egenskaper. Vid tillverkningen finmals kol tillsammans med vatten, varefter bl a svavel och tungmetaller avskiljs och tas till vara. Med en patenterad metod kan det renade kolen sedan lagras, distribueras och användas på samma sätt som vanlig tjockolja. En av de största satsningar Boliden gjort på ett enskilt innovationsprojekt. ",,24140,-100,,,,985,,1,3,2,1980,,1,2,NA,AB Scaniainventor (AB Carbogel) ; Scaniainventor (AB Carbogel) ; 5728002,Helsingborg,NA,,NA,,,NA,NA,NA,1973,NA,NA,NA,NA,NA,NA,1b,5a,12,,,,,,,,,NA,,,,,,NA,1,Boliden ; Boliden ; 9700002,2,SWE,,NA,,,NA,,,NA,,,NA,,,NA,,NA,,NA,,NA,,NA,,NA,,NA,,NA,,NA,,NA,,NA,,NA,,NA,,NA,1 ; Jernkontorets Annaler ;  ; 1980 ; 4 ; 41-42 ; ,,,,,,,,,,,,,,,,,NA
SWINNO - updated,6938001,Ultrasep,,"Ultrafiltreringsmetod. Metoden används för närvarande i Iggesund där avloppsvatten från alkaliextraktionssteget i sulfatblekeriet, som efter systemslutning i kokeri och tvätteri svarar för ca 85 % av totala utsläppet av färg och lignin samt ca 56 % av totala BoOD7-utsläppet, renas med denna metode till en kostnad av 25 kr per ton massa med följande procentuella reningseffekter; färg 87 %, totalt organiskt kol 70 %, biokemisk syreförbrukning (BOD7) 25 %. ",,74202,21,,,,988,,1,2,2,1980,,2,NA,NA,Elektrokemiska AB (EKA) ; Elektrokemiska ; 5897002,,NA,,NA,,,NA,NA,NA,1975,NA,NA,NA,NA,NA,NA,12,7,,,,,,,,Hög reningsgrad,,NA,,,,,,NA,1,De Danske Sukkerfabrikker ; De Danske Sukkerfabrikker ; 13453002,18,DNK,,NA,,,NA,,,NA,,,NA,,,NA,,NA,,NA,,NA,,NA,,NA,,NA,,NA,,NA,,NA,,NA,,NA,,NA,,NA,2 ; Kemisk Tidskrift ;  ; 1980 ; 2 ; 34-39 ; ,1 ; Kemisk Tidskrift ;  ; 1980 ; 12 ; 18 ; ,,,,,,,,,,,,,,,,NA
SWINNO - updated,6943001,Royal-processen,,Metod för att impregnera och ytbehandla trä i samma process.,,74202,20,,,,991,,1,3,2,1980,,2,NA,NA,Assi ; Assi ; 9968002,,NA,,NA,,,NA,NA,NA,NA,NA,NA,NA,NA,NA,NA,7,,,,,,,,,Flera arbetsmoment kan utföras samtidigt.,,NA,,,,,,NA,NA,,NA,,,NA,,,NA,,,NA,,,NA,,,NA,,NA,,NA,,NA,,NA,,NA,,NA,,NA,,NA,,NA,,NA,,NA,,NA,,NA,2 ; Kemisk Tidskrift ;  ; 1980 ; 7 ; 92-96 ; ,,,,,,,,,,,,,,,,,NA
SWINNO - updated,6945001,,,Apparat för ångformning av pappersmassa i en värmeväxlare innan komprimering.,,29550,21,,,,993,,1,2,2,1980,,2,NA,NA,AB Rosenblads Patenter ; Rosenblads Patenter ; 5947002,,NA,,NA,,,NA,NA,NA,NA,NA,NA,NA,NA,NA,NA,7,,,,,,,,,,,NA,,,,,,NA,NA,,NA,,,NA,,,NA,,,NA,,,NA,,,NA,,NA,,NA,,NA,,NA,,NA,,NA,,NA,,NA,,NA,,NA,,NA,,NA,,NA,1 ; Kemisk Tidskrift ;  ; 1980 ; 9 ; 81-86 ; ,,,,,,,,,,,,,,,,,NA
SWINNO - updated,6947001,,,Metod för avhartsning vilket gör att man kan använda färsk ved i massaframställningen.,,74202,21,,,,995,,3,2,2,1980,,2,1,NA,Mo och Domsjö ; Mo och Domsjö ; 5906002,Domsjö,NA,,NA,,,NA,NA,NA,1978,NA,NA,NA,NA,NA,NA,3,,,,,,,,,,,NA,,,,,,NA,NA,,NA,,,NA,,,NA,,,NA,,,NA,,,NA,,NA,,NA,,NA,,NA,,NA,,NA,,NA,,NA,,NA,,NA,,NA,,NA,,NA,1 ; Kemisk Tidskrift ;  ; 1981 ; 3 ; 101-102 ; ,1 ; Kemisk Tidskrift ;  ; 1981 ; 3 ; 101-102 ; ,,,,,,,,,,,,,,,,NA
SWINNO - updated,7949001,,,Destillationsmetod för etanol. Det nya med metoden är att det går att återföra en del av den energi som går åt i destillationsprocessen. Metoden ska återvinna sprit som används i kemiska processer. ,,74202,90,,,,1004,,1,2,2,1980,,1,2,NA,Sorigona AB ; Sorigona ; 9967002,Staffanstorp,NA,,NA,,,NA,NA,NA,NA,NA,NA,NA,NA,NA,NA,1b,5a,,,,,,,,,,NA,,,,,,NA,NA,,NA,,,NA,,,NA,,,NA,,,NA,,,NA,,NA,,1,Statens Industriverk ; Statens Industriverk ; 12390002,2,,NA,,NA,,NA,,NA,,NA,,NA,,NA,,NA,,NA,,NA,1 ; Ny Teknik ;  ; 1980 ; 6 ; 5 ; ,,,,,,,,,,,,,,,,,NA
SWINNO - updated,7950001,,,"Metod för torkning av fasta, fuktiga bränslen. Massatorken skiljer sig från konventionella torkar genom att systemet är slutet. Inne i rörsystemet, som består av vertikala ledare förenade med 180 graders krökar, rusar överhettad nga fram i en hastighet av 30 meter per sekund. Överskottsångan som bildas inne i systemet under torkningsprocessen tappas av och kan användas till exempelvis fjärruppvärmning. Mottryckstorken har utsikt att göra torven lönsam att använda som bränsle i Sverige",,29550,21,,,,1005,,1,2,1,1980,,1,2,1,MoDo-Chemetics AB ; MoDo-Chemetics ; 9783002, Örnsköldsvik,NA,MoDo,NA,,,NA,NA,NA,1973,NA,NA,NA,NA,NA,NA,1b,5a,7,12,19,,,,,,,1,,,,Chalmers Tekniska Högskola,,NA,1,Chalmers Tekniska Högskola ; Chalmers Tekniska Högskola ; 13439002,11,SWE,,NA,,,NA,,,NA,,,NA,,,NA,,NA,,NA,,NA,,NA,,NA,,NA,,NA,,NA,,NA,,NA,,NA,,NA,,NA,1 ; Ny Teknik ;  ; 1980 ; 6 ; 10 ; ,,,,,,,,,,,,,,,,,NA
SWINNO - updated,7967001,Rotellmotorn,,"Pneumatiskt driven stegmotor. Jämfört med konventionella elektriska stegmotorer är den lättare, kompaktare och har en mycket högre precision. Den kan styras antingen med luft eller elektroniskt. Stegmotorer används då man vill uppnå en noggrann rörelse eller en positionering av en last. Dessa motorer får allt större betydelse inom reglertekniken. De flesta drivs elektriskt men den här drivs pneumatiskt, det är det som gör den unik. I miljöer där det finns en explosionsrisk är motorn idealisk. ",,31100,-100,,,,1019,,1,2,2,1980,,1,2,NA,Pro Inventec AB ; Pro Inventec ; 6969002,,NA,,NA,,,NA,NA,NA,1970,NA,NA,NA,NA,NA,NA,1b,7,,,,,,,,"Lättare, kompaktare, högre precission",,NA,,,,,,NA,NA,,NA,,,NA,,,NA,,,NA,,,NA,,,NA,,NA,,NA,,NA,,NA,,NA,,NA,,NA,,NA,,NA,,NA,,NA,,NA,,NA,1 ; Ny Teknik ;  ; 1980 ; 20 ; 10-11 ; ,,,,,,,,,,,,,,,,,NA
SWINNO - updated,7991001,,,Metod för att avhartsa sulfitmassa. Metoden för lagring av flis onödig; istället försvinner hartset när sulfitmassan bearbetas mekaniskt tillsammans med kemikalier. ,Chemical and Plastics,21112,211,,,,1038,,1,2,2,1980,,2,2,NA,MoDo ; MoDo ; 10106002,Örnsköldsvik,NA,,NA,,,NA,NA,NA,1978,NA,NA,NA,NA,NA,NA,7,5a,,,,,,,,Snabbar upp avhartsning,,NA,,,,,,NA,NA,,NA,,,NA,,,NA,,,NA,,,NA,,,NA,,NA,,NA,,NA,,NA,,NA,,NA,,NA,,NA,,NA,,NA,,NA,,NA,,NA,1 ; Ny Teknik ;  ; 1980 ; 43 ; 12 ; ,,,,,,,,,,,,,,,,,NA
SWINNO - updated,8015001,Nitspiken,,"Spik med ""synålsöga"" i den vassa änden. Öglan pressas isär när spiken når mothåll och förhindrar att den vandrar i trät. ",Machinery and Equipment,28730,204,,,,1053,,1,3,3,1980,,1,2,NA,AB H Brunner ; H Brunner ; 7017002,Örebro,NA,,NA,,,NA,NA,NA,NA,NA,NA,NA,NA,NA,NA,1b,3,,,,,,,,,,NA,,,,,,NA,NA,,NA,,,NA,,,NA,,,NA,,,NA,,,NA,,NA,,NA,,NA,,NA,,NA,,NA,,NA,,NA,,NA,,NA,,NA,,NA,,NA,1 ; Ny Teknik ;  ; 1981 ; 6 ; 18 ; ,,,,,,,,,,,,,,,,,NA
SWINNO - updated,9443001,Compozil,,"Dubbelverkande bindemedel som består av ett modifierat anjoniskt silikat och ett katjoniskt stärkelsederivat som har förmågan att kemiskt reagera med fyllnadsmedel under utfällning av partiklar med stor yta, och ger ett nytt sätt att angripa retentions- och avvattningsproblem i produktion av pappersmassa",,24160,21,,,,1064,"http://www.akzonobel.com/eka/inspiration/better_performance_results/
EKA AB was a company that belonged to Iggesund, but was bought in 1986 by Nobel Industrier. At some point the company's name was changed to Eka Nobel. (Svensk Papperstidning, 1992, nr. 7, p. 22-25)
Later the name changed to Eka Chemicals. (Svensk Papperstidning, 2000, nr. 8, p. 69-70)",1,3,1,1980,,1,2,NA,EKA ; Elektrokemiska ; 5897002,,NA,,NA,,,NA,NA,NA,NA,NA,NA,NA,NA,NA,NA,1b,5b,7,,,,,,problem vid produktion av pappersmassa med retention och avvattning; finpartiklar i papperet försvinner,"Besparing av energi utan att pappersmassan förlorar sin styrka eller opacitet, förbättrar retention och avvattning, ger ökad torkstyrka. ",,NA,,,,,,NA,NA,,NA,,,NA,,,NA,,,NA,,,NA,,,NA,,NA,,NA,,NA,,NA,,NA,,NA,,NA,,NA,,NA,,NA,,NA,,NA,,NA,2 ; Svensk Trävaru och Pappersmassetidning ;  ; 1982 ; 3 ; 185 ; ,2 ; Svensk Papperstidning ;  ; 1992 ; 7 ; 22-25 ; ,2 ; Svensk Papperstidning ;  ; 2000 ; 8 ; 69-70 ; ,,,,,,,,,,,,,,,NA
SWINNO - updated,10564001,Biomatic Komplett,,"Varmluftsanläggning för eldning med flis, sågspån och torv, i första hand avsedd för spannmålstorkar, växthus, sågverk och industrier. Systeet är uppbyggt av två enheter, en varmluftspanna med automatiskt styrd förbränning samt en fastbränslebehållare (kallad Biomatic Komplett). Fastbränslebehållaren består i sin tur av bränslebehållare och en helautomatisk utmatningsanordning vilket minskar risken för att bränslet fastnar.",,29230,1115,112,20101,-100,1087,,1,2,2,1980,,2,NA,NA,Edifo Industrikonsult AB ; Edifo Industrikonsult ; 9566002,Skellefteå,NA,,NA,,,NA,NA,NA,NA,NA,NA,NA,NA,NA,NA,7,,,,,,,,,Automatisering (av förbränningen),,NA,,,,,,NA,NA,,NA,,,NA,,,NA,,,NA,,,NA,,,NA,,NA,,NA,,NA,,NA,,NA,,NA,,NA,,NA,,NA,,NA,,NA,,NA,,NA,1 ; VVS ;  ; 1980 ; 7-8 ; 69 ; ,,,,,,,,,,,,,,,,,NA
SWINNO - updated,6125001,GHP 2000,,Pallinslagare för helautomatisk förpackningslinje. Pallinslagaren läser av pallhöjden och der en impuls till huvpåträdaren hur stor huv som krävs för emballeringen. Den unika påträdaren gör att tunnare film kan användas. ,,29569,-100,,,,1094,,1,2,3,1981,,2,2,NA,AB Gelo-Maskiner ; Gelo-Maskiner ; 9789002,Kungälv,NA,,NA,,,NA,NA,NA,NA,NA,NA,NA,NA,NA,NA,7,,,,,,,,,,,NA,,,,,,NA,NA,,NA,,,NA,,,NA,,,NA,,,NA,,,NA,,NA,,NA,,NA,,NA,,NA,,NA,,NA,,NA,,NA,,NA,,NA,,NA,,NA,1 ; Automation ;  ; 1981 ; 5 ; 34 ; ,,,,,,,,,,,,,,,,,NA
SWINNO - updated,6949001,,,Värmeväxlare som lämpar sig för återvinning av de stora värmemängderna i avloppsvatten från massa- och pappersbruk. ,,29230,21,,,,1100,,1,2,2,1981,,2,NA,NA,Axel Johnson Engineering AB ; Axel Johnson Engineering ; 9969002,,NA,,NA,,,NA,NA,NA,NA,NA,NA,NA,NA,NA,NA,5a,12,,,,,,,,,,NA,,,,,,NA,NA,,NA,,,NA,,,NA,,,NA,,,NA,,,NA,,NA,,NA,,NA,,NA,,NA,,NA,,NA,,NA,,NA,,NA,,NA,,NA,,NA,2 ; Kemisk Tidskrift ;  ; 1981 ; 7 ; 80 ; ,,,,,,,,,,,,,,,,,NA
SWINNO - updated,6950001,Sunds Defibrator Papperstorkning med TMP-ånga,,"Värmeåtervinningssystem för en termomekanisk massafabrik, som kan ge all den ånga, som behövs för att torka det papper, som tillveras av massan i ett integrerat bruk. När massafabriken av någon anledning inte är igång, används den abonnerade kraften för att generera ånga i en elektrisk ångpanna. Ett pannhus med oljeeldad panna kan undvikar och driftskostnaderna blir mycket lägre. ",,29230,21,,,,1101,,1,2,2,1981,,2,NA,NA,Sunds Defibrator ; Sunds Defibrator ; 9970002,,NA,,NA,,,NA,NA,NA,NA,NA,NA,NA,NA,NA,NA,12,7,,,,,,,,Sparar pengar och utrmme.,,NA,,,,,,NA,1,Alfa-Laval ; Alfa Laval ; 9800002,17,SWE,,NA,,,NA,,,NA,,,NA,,,NA,,NA,,NA,,NA,,NA,,NA,,NA,,NA,,NA,,NA,,NA,,NA,,NA,,NA,3 ; Kemisk Tidskrift ;  ; 1981 ; 7 ; 82 ; ,2 ; Kemisk Tidskrift ;  ; 1982 ; 7 ; 76-77 ; ,5 ; SPCI Svensk Papperstidning ;  ; 2015 ; 2 ; 8 ; ,,,,,,,,,,,,,,,NA
SWINNO - updated,7238001,,,Metod för att utvinna råfett av livsmedelskvalitet ur styckningsben. I processen används inga kemiska lösningsmedel. Den är mera energisnål än konventionella metoder samt undviker de vanliga miljömässiga olägenheterna. ,,29530,1541,,,,1103,,1,1,2,1981,,1,2,NA,Alfa-Laval AB ; Alfa Laval ; 9800002,Lund,NA,Alfa-Laval AB,NA,,,NA,NA,NA,NA,NA,NA,NA,NA,NA,NA,5a,1b,,,,,Teknik för att utvinna råfett. ,,,,,NA,,,,,,NA,NA,,NA,,,NA,,,NA,,,NA,,,NA,,,NA,,NA,,NA,,NA,,NA,,NA,,NA,,NA,,NA,,NA,,NA,,NA,,NA,,NA,1 ; Livsmedelsteknik ;  ; 1981 ; 4 ; 192-193 ; ,,,,,,,,,,,,,,,,,NA
SWINNO - updated,7448001,Aktiv Skotten 758,,Skogsmaskin med ovan nämnda gripprocessor. ,,29320,2,,,,1105,Rättigheterna till kombinationen ägs av Svenska Lantmäns riksförbund. Maskinen säljs av Volvo BM. Jag antar att maskinen tillverkas av Skogsjan.,1,2,2,1981,,NA,NA,NA,Skogsjan AB ; Skogsjan ; 10055002,Österfärnebo (Söderhamn?),NA,,NA,,,NA,NA,NA,NA,NA,NA,NA,NA,NA,NA,7,5a,,,,,,,,,,NA,,,,,,NA,NA,,NA,,,NA,,,NA,,,NA,,,NA,,,NA,,NA,,NA,,NA,,NA,,NA,,NA,,NA,,NA,,NA,,NA,,NA,,NA,,NA,1 ; Sågverken ;  ; 1981 ; 10 ; 67 ; ,,,,,,,,,,,,,,,,,NA
SWINNO - updated,8057001,Mecerprocessen,,"Teknik för att återvinna koppar vid etsning av kretskort. Processen är slute, både koppar och etsbad kan användas upprepade gånger. Metoden kallas vätskeextraktion och är en hydrometallurgisk metod. ",Wastewater Treatment,37100,321,322,323,,1141,,1,2,2,1981,,1,2,NA,MX Processer AB ; MX Processer ; 9957002,Göteborg,NA,,NA,,,NA,NA,NA,1979,NA,NA,NA,NA,NA,NA,5a,1b,,,,,,,,,,NA,,,,,,NA,NA,,NA,,,NA,,,NA,,,NA,,,NA,,,NA,,NA,,1,STU ; Styrelsen för teknisk utveckling ; 12398002,1,Utvecklingsfonden ; Utvecklingsfonden ; 12447002,6,,NA,,NA,,NA,,NA,,NA,,NA,,NA,,NA,,NA,1 ; Ny Teknik ;  ; 1981 ; 22 ; 16 ; ,,,,,,,,,,,,,,,,,NA
SWINNO - updated,8085001,,,Profilsystem för beklädnad av träfönster. Med profilsystemet blir fönstrena näst intill underhållsfria. Profilerna är i stål. ,Machinery and Equipment,28120,20302,,,,1157,,1,3,3,1981,,1,2,NA,Dobel AB ; Dobel ; 10119002,Borlänge,NA,,NA,,,NA,NA,NA,NA,NA,NA,NA,NA,NA,NA,5a,5b,,,,,,,Mycket underhåll av träfönster. ,,,NA,,,,,,NA,NA,,NA,,,NA,,,NA,,,NA,,,NA,,,NA,,NA,,NA,,NA,,NA,,NA,,NA,,NA,,NA,,NA,,NA,,NA,,NA,,NA,1 ; Ny Teknik ;  ; 1981 ; 48 ; 10 ; ,,,,,,,,,,,,,,,,,NA
SWINNO - updated,8086001,Ebenol,,Träpulver för förbränning och i förlängningen energigenerering. Produktion påbörjad efter inspiration av oljekrisen. ,Chemical and Plastics,20101,-100,,,,1158,,1,3,3,1981,,1,NA,NA,Energibränsle AB ; Energibränsle ; 7088002,Ulricehamn,NA,,1,,,NA,NA,NA,1976,NA,NA,NA,NA,NA,NA,5a,,,,,,,,,,,NA,,,,,,NA,NA,,NA,,,NA,,,NA,,,NA,,,NA,,,NA,,NA,,NA,,NA,,NA,,NA,,NA,,NA,,NA,,NA,,NA,,NA,,NA,,NA,1 ; Ny Teknik ;  ; 1981 ; 48 ; 20 ; ,,,,,,,,,,,,,,,,,NA
SWINNO - updated,9296001,,,Metod (utrustning bestående av svetsring och styrutrustning) för att skarva mantelrör på fjärrvärmeledningar som bygger på plastmaterialets strävan att vid en viss temperatur återta sin ursprungliga form,,29430,45331,,,,1165,,1,2,2,1981,,1,NA,1,Swedish Joint AB ; Swedish Joint ; 8298002,Borås,NA,,NA,,,NA,NA,NA,NA,NA,NA,NA,NA,NA,NA,20,5a,7,,,,,,,Eliminerar behovet att limma eller krympa fast förbandet över kulvertskarven,"Innovationen är en metod utarbetad av civilingenjör Birger Flink i Uppsala. Metoden bygger på ett praktiskt utnyttjande av 'det termiska minnet', d.v.s. plastmaterialets trävan att vid en viss temperatur återta sin ursprungliga form.",NA,,,,,,NA,NA,,NA,,,NA,,,NA,,,NA,,,NA,,,NA,,NA,,NA,,NA,,NA,,NA,,NA,,NA,,NA,,NA,,NA,,NA,,NA,,NA,1 ; Plastforum Scandinavia ;  ; 1981 ; 3 ; 27 ; ,1 ; VVS ;  ; 1982 ; 5 ; 13 ; ,,,,,,,,,,,,,,,,NA
